"SCHULDT S, 2020, J PERFORM CONSTR FACIL","SCHULDT S;EL-RAYES K;SOYLEMEZOGLU N","REMOTE CONSTRUCTION SITE; BLAST EFFECTS; CONSEQUENCE; BLAST WALL;; SECURITY; TERRORISM; FACILITY LAYOUT; GENETIC ALGORITHMS; OPTIMIZATION","POSTTRAUMATIC-STRESS-DISORDER; TERRORIST ATTACKS; PSYCHIATRIC-DISORDERS;; ESTIMATING DOWNTIME; GENETIC ALGORITHM; CRITICAL ASSET; RISK ANALYSIS;; BLAST INJURY; BUILDINGS; VICTIMS","SCHULDT, S (CORRESPONDING AUTHOR), AIR FORCE INST TECHNOL, ENGN MANAGEMENT, DEPT SYST ENGN \& MANAGEMENT, 2950 HOBSON WAY, WRIGHT PATTERSON AFB, OH 45433 USA.; SCHULDT, STEVEN, AIR FORCE INST TECHNOL, ENGN MANAGEMENT, DEPT SYST ENGN \& MANAGEMENT, 2950 HOBSON WAY, WRIGHT PATTERSON AFB, OH 45433 USA.; EL-RAYES, KHALED, UNIV ILLINOIS, DEPT CIVIL \& ENVIRONM ENGN, 205 N MATTHEWS AVE, URBANA, IL 61801 USA.; SOYLEMEZOGLU, AHMET; GARFINKLE, NOAH, US ARMY, CORPS ENGINEERS, CONSTRUCT ENGN RES LAB, ENGINEER RES \& DEV CTR, 2902 NEWMARK DR, CHAMPAIGN, IL 61826 USA.","ABBOTTS R, 2007, J R ARMY MED CORPS, V153, P119; ABENHAIM L, 1992, J CLIN EPIDEMIOL, V45, P103, DOI 10.1016/0895-4356(92)90002-5; ABOTALEB I, 2016, AUTOMAT CONSTR, V66, P15, DOI 10.1016/J.AUTCON.2016.02.007; AL KAZIMI A, 2016, 2016 IEEE SYSTEMS AND INFORMATION ENGINEERING DESIGN SYMPOSIUM (SIEDS), P32, DOI 10.1109/SIEDS.2016.7489322; ANONYMOUS, 2000, P581 FEMA, V1; ANTELMAN A, 2008, INFRASTRUCTURE REPOR, P141, DOI DOI 10.1061/9780784409589.CH19; ARNOLD JL, 2004, ANN EMERG MED, V43, P263, DOI 10.1016/S0196-0644(03)00723-6; ATAEI H., 2012, FORENSIC ENG 2012, P133; AVIDAN V, 2005, AM J SURG, V190, P927, DOI 10.1016/J.AMJSURG.2005.08.022; AYYUB BM, 2007, RISK ANAL, V27, P789, DOI 10.1111/J.1539-6924.2007.00911.X; BAILEY JRB, 2008, PROCESS SAF PROG, V27, P41, DOI 10.1002/PRS.10218; BLOMBERG SB, 2004, J MONETARY ECON, V51, P1007, DOI 10.1016/J.JMONECO.2004.04.001; BUTLER A.S., 2003, PREPARING PSYCHOL CO; CAVE KM, 2007, MIL MED, V172, P726, DOI 10.7205/MILMED.172.7.726; COMERIO M.C, 2000, EC BENEFITS DISASTER; COMERIO MC, 2010, EARTHQ SPECTRA, V26, P951, DOI 10.1193/1.3477993; COMERIO MC, 2006, EARTHQ SPECTRA, V22, P349, DOI 10.1193/1.2191017; DEB K, 2002, IEEE T EVOLUT COMPUT, V6, P182, DOI 10.1109/4235.996017; DILLON RL, 2009, RISK ANAL, V29, P321, DOI 10.1111/J.1539-6924.2008.01196.X; DIXON L., 2004, COMPENSATION LOSSES; DOD (DEPARTMENT OF DEFENSE), 2012, 401001 DOD UFC; EL-ANWAR O, 2010, J CONSTR ENG M, V136, P794, DOI 10.1061/(ASCE)CO.1943-7862.0000185; ENDERS W., 2012, OXFORD HDB EC PEACE, P874; FEMA (FEDERAL EMERGENCY MANAGEMENT AGENCY), 2011, FEMA426BIPS06; GABRIEL R, 2007, EUR PSYCHIAT, V22, P339, DOI 10.1016/J.EURPSY.2006.10.007; GALEA S, 2002, NEW ENGL J MED, V346, P982, DOI 10.1056/NEJMSA013404; GARTH RJN, 1995, INJURY, V26, P363, DOI 10.1016/0020-1383(95)00042-8; GRUSSING M. N., 2010, DEV ARMY FACILITY MI; HARTLEY KEITH, 2007, HDB DEFENSE EC, V2, P815; HUBBARD C., 2002, BASE DEFENSE SPECIAL; HUNTER J., 2015, EXPLOSIVE STATES AOA; IEP (INSTITUTE FOR ECONOMICS AND PEACE), 2015, GLOB TERR IMP 2015 M; KARYDAS DM, 2006, RELIAB ENG SYST SAFE, V91, P84, DOI 10.1016/J.RESS.2004.11.016; KHALAFALLAH A, 2008, J CONSTR ENG M ASCE, V134, P40, DOI 10.1061/(ASCE)0733-9364(2008)134:1(40); KHALAFALLAH A, 2011, AUTOMAT CONSTR, V20, P313, DOI 10.1016/J.AUTCON.2010.11.001; LI ZM, 2015, AUTOMAT CONSTR, V57, P1, DOI 10.1016/J.AUTCON.2015.04.011; LI ZM, 2015, J IND MANAG OPTIM, V11, P595, DOI 10.3934/JIMO.2015.11.595; LONGINOW A, 1996, PRACT PERIOD STRUCT, V1, P51; MALLONEE S, 1996, JAMA-J AM MED ASSOC, V276, P382, DOI 10.1001/JAMA.276.5.382; MCGILL WL, 2007, RISK ANAL, V27, P1265, DOI 10.1111/J.1539-6924.2007.00955.X; MELLOR SG, 1992, WORLD J SURG, V16, P893, DOI 10.1007/BF02066988; MORLEY MG, 2010, DISASTER MED PUBLIC, V4, P154, DOI 10.1001/DMP.V4N2.HRA10003; NERIA Y, 2008, PSYCHOL MED, V38, P467, DOI 10.1017/S0033291707001353; NOBLIS, 2010, SUST FORW OP BAS; NORTH CS, 1999, JAMA-J AM MED ASSOC, V282, P755, DOI 10.1001/JAMA.282.8.755; NORTH CS, 2002, AM J PSYCHIAT, V159, P857, DOI 10.1176/APPI.AJP.159.5.857; NORVILLE HS, 1999, J PERFORM CONSTR FAC, V13, P50, DOI DOI 10.1061/(ASCE)0887-3828(1999)13:2(50); PACHAKIS D, 2004, EARTHQ SPECTRA, V20, P427, DOI 10.1193/1.1705655; PELLING M., 2002, PROG DEV STUD, V2, P283, DOI DOI 10.1191/1464993402PS042RA; PERKINS R., 2015, 4 YEARS HARM EXPLOSI; PLOTNER S.C., 2017, BUILDING CONSTRUCTIO; PORTER KEITH, 2012, J BUS CONTIN EMER PLAN, V5, P352; REMENNIKOV AM, 2007, INT J IMPACT ENG, V34, P1907, DOI 10.1016/J.IJIMPENG.2006.11.003; ROSE AZ, 2010, PEACE ECON PEACE SCI, V16, DOI 10.2202/1554-8597.1189; ROSE AZ, 2009, J HOMEL SECUR EMERG, V6, DOI 10.1111/J.1468-3156.1978.TB00379.X; ROSSUM G, 1995, PYTHON REFERENCE MAN; SAID H, 2013, AUTOMAT CONSTR, V36, P71, DOI 10.1016/J.AUTCON.2013.08.008; SAID H, 2010, AUTOMAT CONSTR, V19, P221, DOI 10.1016/J.AUTCON.2009.10.005; SASSER SM, 2006, PREHOSP EMERG CARE, V10, P165, DOI 10.1080/10903120500540912; SCHLENGER WE, 2002, JAMA-J AM MED ASSOC, V288, P581, DOI 10.1001/JAMA.288.5.581; SCHULDT S, 2018, J CONSTR ENG M, V144, DOI 10.1061/(ASCE)CO.1943-7862.0001446; SCHULDT S, 2017, J PERFORM CONSTR FAC, V31, DOI 10.1061/(ASCE)CF.1943-5509.0001015; SCHUSTER MA, 2001, NEW ENGL J MED, V345, P1507, DOI 10.1056/NEJM200111153452024; STROBEL K, 2013, PROC INST CIV ENG-FO, V166, P116, DOI 10.1680/FENG.12.00023; STUHMILLER JH, 1996, J BIOMECH, V29, P227, DOI 10.1016/0021-9290(95)00039-9; THOMPSON D, 2004, J TRAUMA, V57, P208, DOI 10.1097/01.TA.0000142672.99660.80; TONG ZY, 2016, AUTOMAT CONSTR, V72, P46, DOI 10.1016/J.AUTCON.2016.10.001; USACE, 2016, DOD AR COST FACT; USACE, 1999, 11103495 USACE ETL; VAZQUEZ C, 2008, J ANXIETY DISORD, V22, P1326, DOI 10.1016/J.JANXDIS.2008.01.014; VERGER P, 2004, AM J PSYCHIAT, V161, P1384, DOI 10.1176/APPI.AJP.161.8.1384; WIGHTMAN JM, 2001, ANN EMERG MED, V37, P664, DOI 10.1067/MEM.2001.114906","REMOTE CONSTRUCTION SITES, SUCH AS OIL PRODUCTION FACILITIES AND MILITARY FORWARD OPERATING BASES, ARE FREQUENTLY TARGETED BY EXPLOSIVE TERRORIST ATTACKS. THESE ATTACKS PRODUCE DEVASTATING AND FAR-REACHING CONSEQUENCES THAT CAN BE GROUPED INTO FOUR MAIN CATEGORIES: PERSONNEL LOSS, PSYCHOLOGICAL IMPACT, ECONOMIC LOSS, AND OPERATIONAL IMPACT. EXISTING SECURITY MODELS RELY ON TIME-CONSUMING EXTERNAL BLAST ANALYSIS SOFTWARE PACKAGES TO QUANTIFY THE CONSEQUENCES OF EXPLOSIVE ATTACKS AND THEREFORE CANNOT BE USED TO OPTIMIZE THE LAYOUT PLANNING OF REMOTE CONSTRUCTION SITES. THIS PAPER DEVELOPED A NOVEL FACILITY LAYOUT OPTIMIZATION MODEL CAPABLE OF DIRECTLY QUANTIFYING BLAST CONSEQUENCES AND GENERATING OPTIMAL SITE LAYOUT PLANS AND PROTECTION STRATEGIES. THE MODEL IS IMPLEMENTED USING MULTIOBJECTIVE GENETIC ALGORITHMS TO IDENTIFY SOLUTIONS THAT PROVIDE OPTIMAL TRADEOFFS BETWEEN THE COMPETING OBJECTIVES OF MINIMIZING SITE EXPLOSIVE ATTACK CONSEQUENCES AND MINIMIZING SITE CONSTRUCTION COSTS. A CASE STUDY OF A HYPOTHETICAL REMOTE MILITARY BASE WAS ANALYZED TO DEMONSTRATE THE USE OF THE MODEL AND DISPLAY ITS UNIQUE CAPABILITIES. (C) 2019 AMERICAN SOCIETY OF CIVIL ENGINEERS.","1801 ALEXANDER BELL DR, RESTON, VA 20191-4400 USA","AIR FORCE INSTITUTE OF TECHNOLOGY (AFIT); UNIVERSITY OF ILLINOIS SYSTEM; UNIVERSITY OF ILLINOIS URBANA-CHAMPAIGN; UNITED STATES DEPARTMENT OF DEFENSE; UNITED STATES ARMY; U.S. ARMY CORPS OF ENGINEERS; U.S. ARMY ENGINEER RESEARCH \& DEVELOPMENT CENTER (ERDC); CONSTRUCTION ENGINEERING RESEARCH LABORATORY (CERL)","04019099","STEVEN.SCHULDT@AFIT.EDU ELRAYES@ILLINOIS.EDU AHMET.SOYLEMEZOGLU@ERDC.DREN.MIL NOAH.W.GARFINKLE@ERDC.DREN.MIL","2022-12-01","KD1HT","10.1061/(ASCE)CF.1943-5509.0001354",NA,"1943-5509",NA,NA,NA,NA,"0887-3828","J. PERFORM. CONSTR. FACIL.","JOURNAL OF PERFORMANCE OF CONSTRUCTED FACILITIES","ENGLISH","FEB 1","72","1","SCHULDT, STEVEN/0000-0002-4234-7454",NA,"ASCE-AMER SOC CIVIL ENGINEERS","CONSTRUCTION \& BUILDING TECHNOLOGY; ENGINEERING",1,"MINIMIZING CONSEQUENCES OF EXPLOSIVE ATTACKS ON REMOTE CONSTRUCTION SITES","ARTICLE","WOS000507623300009","0","5","34","CONSTRUCTION \& BUILDING TECHNOLOGY; ENGINEERING, CIVIL","SCIENCE CITATION INDEX EXPANDED (SCI-EXPANDED); SOCIAL SCIENCE CITATION INDEX (SSCI)",2020,"SCHULDT, S (CORRESPONDING AUTHOR), AIR FORCE INST TECHNOL, ENGN MANAGEMENT, DEPT SYST ENGN \& MANAGEMENT, 2950 HOBSON WAY, WRIGHT PATTERSON AFB, OH 45433 USA","ISI","SCHULDT;SCHULDT;UNIV ILLINOIS;ENGINEER RES AND DEV CTR","SCHULDT","SCHULDT S, 2020, J PERFORM CONSTR FACIL","SCHULDT S, 2020, J PERFORM CONSTR FACIL","USA",3,0
"SILVA-CASTRO J, 2019, CAN GEOTECH J","SILVA-CASTRO J","GROUND VIBRATIONS; BLASTING; SIGNATURE HOLE TECHNIQUE; WAVEFORM; SUPERPOSITION; FOURIER SERIES",NA,"SILVA-CASTRO, J (CORRESPONDING AUTHOR), UNIV KENTUCKY, M\&MRB, 504 ROSE ST, LEXINGTON, KY 40502 USA.; SILVA-CASTRO, JHON, UNIV KENTUCKY, M\&MRB, 504 ROSE ST, LEXINGTON, KY 40502 USA.","ANDERSON D. A., 2008, P ANN C EXPL BLAST T, V34, P27; BLAIR DP, 2008, INT J ROCK MECH MIN, V45, P235, DOI 10.1016/J.IJRMMS.2007.05.002; BLAIR D. P., 2004, FRAGBLAST, V8, P221, DOI 10.1080/13855140412331291610; BLAIR D.P., 1999, FRAGBLAST, V3, P335, DOI 10.1080/13855149909408056, DOI 10.1080/13855149909408056; BLAIR D.P., 2011, PROC 6 EFEE WORLD C, P319; BLAIR D.P., 1999, FRAGBLAST, V3, P303; BLAIR DP, 1993, INT J NUMER ANAL MET, V17, P95, DOI 10.1002/NAG.1610170203; CHI-TSONG C., 2004, SIGNALS SYSTEMS; FARADONBEH RS, 2016, INT J ENVIRON SCI TE, V13, P1453, DOI 10.1007/S13762-016-0979-2; HASANIPANAH M, 2015, MEASUREMENT, V75, P289, DOI 10.1016/J.MEASUREMENT.2015.07.019; HAYES MH, 1980, IEEE T ACOUST SPEECH, V28, P672, DOI 10.1109/TASSP.1980.1163463; LUSK B., 2012, SME T, V332, P440; LUSK B. T., 2012, BLASTING FRAGMENTATI, V6, P10; OPPENHEIM A., 1999, DISCRETE TIME SIGNAL, P781; SILVA-CASTRO J., 2015, BLASTING FRAGMENTATI, V9, P21; SILVA-CASTRO J., 2012, THESIS; SOBOL I. M., 1960, POPULAR LECT MATH; SPATHIS A. T., 2006, FRAGBLAST, V10, P9, DOI 10.1080/13855140600849957; SPATHIS AT, 2010, VIBRATIONS FROM BLASTING, P1; YANG R., 2009, INT S ROCK FRAGM BLA, P597","GROUND VIBRATION PREDICTION AND CONTROL FROM MINE BLASTING IS A COMPLEX TASK INVOLVING DISCIPLINES SUCH AS GEOTECHNICAL ENGINEERING, EXPLOSIVES ENGINEERING, AND GEOLOGY. DESPITE THE IMPORTANCE OF CONTROLLING GROUND VIBRATIONS, THE MINING INDUSTRY COMMONLY USES EMPIRICAL METHODOLOGIES BASED ON CONCEPTS RELATED TO THE NUCLEAR TESTS ERA (CHARGE WEIGHT SCALING RELATIONSHIPS). OVER THE PAST DECADE, ATTEMPTS HAVE BEEN MADE TO POPULARIZE MORE ELABORATE METHODOLOGIES. THESE METHODS RANGE FROM BASIC WAVEFORM SUPERPOSITION TO ANALYTICAL AND NUMERICAL METHODS. SUCH METHODOLOGIES ARE DIFFICULT TO UTILIZE DAILY BECAUSE OF THEIR COMPLEXITY, SOMETIMES LOW ACCURACY (DESPITE THEIR SOPHISTICATION), REQUIREMENT FOR DIFFICULT TO OBTAIN PARAMETERS, AND TIME NEEDED TO REACH SOLUTIONS USING COMPLEX ALGORITHMS. IN THIS PAPER, A DIFFERENT METHODOLOGY TO CONTROL AND PREDICT GROUND VIBRATIONS FROM BLASTING IS PRESENTED. THIS METHODOLOGY USES A SEMI-EMPIRICAL APPROACH, WHERE THE GENERATION AND PROPAGATION OF GROUND VIBRATION WAVES AND THE GROUND VIBRATION CHARACTERISTICS AT A POINT OF INTEREST ARE CONSIDERED THROUGH THE COLLECTION OF A SIGNATURE WAVEFORM. THE METHODOLOGY ALLOWS ASSESSMENT OF THE OPTIMUM DELAY BETWEEN CHARGES TO MINIMIZE AND CONTROL GROUND VIBRATION LEVELS. A CASE STUDY IS INCLUDED TO DEMONSTRATE THE BENEFITS AND THE METHODOLOGY IN DETAIL.","65 AURIGA DR, SUITE 203, OTTAWA, ON K2E 7W6, CANADA","UNIVERSITY OF KENTUCKY",NA,"JHON.SILVA@UKY.EDU","2022-12-01","IG1HH","10.1139/cgj-2018-0073",NA,"1208-6010",NA,NA,NA,NA,"0008-3674","CAN. GEOTECH. J.","CANADIAN GEOTECHNICAL JOURNAL","ENGLISH","JUL","20","7",NA,"929-941","CANADIAN SCIENCE PUBLISHING, NRC RESEARCH PRESS","ENGINEERING; GEOLOGY",3,"A DIFFERENT METHODOLOGY TO CONTROL AND PREDICT GROUND VIBRATIONS FROM MINE BLASTING","ARTICLE","WOS000473541000002","1","15","56","ENGINEERING, GEOLOGICAL; GEOSCIENCES, MULTIDISCIPLINARY","SCIENCE CITATION INDEX EXPANDED (SCI-EXPANDED)",2019,"SILVA-CASTRO, J (CORRESPONDING AUTHOR), UNIV KENTUCKY, M\&MRB, 504 ROSE ST, LEXINGTON, KY 40502 USA","ISI","UNIV KENTUCKY;UNIV KENTUCKY","UNIV KENTUCKY","SILVA-CASTRO J, 2019, CAN GEOTECH J","SILVA-CASTRO J, 2019, CAN GEOTECH J","USA",1,0
"SINGH J, 2022, MATER ADV","SINGH J;STAPLES RJ;SHREEVE JM",NA,"AZO; STRATEGY; NITROGEN; RDX; EXPLOSIVES; CHEMISTRY; MECHANISM; DESIGN;; HMX","SHREEVE, JM (CORRESPONDING AUTHOR), UNIV IDAHO, DEPT CHEM, MOSCOW, ID 83844 USA.; SINGH, JATINDER; SHREEVE, JEAN'NE M., UNIV IDAHO, DEPT CHEM, MOSCOW, ID 83844 USA.; STAPLES, RICHARD J., MICHIGAN STATE UNIV, DEPT CHEM, E LANSING, MI 48824 USA.","CHAKRABORTY D, 2000, J PHYS CHEM A, V104, P2261, DOI 10.1021/JP9936953; CHAVEZ DE, 2017, ANGEW CHEM INT EDIT, V56, P3575, DOI 10.1002/ANIE.201612496; CHENG YF, 2021, CRYSTENGCOMM, V23, P1953, DOI 10.1039/D0CE01882A; CHINNAM AK, 2020, DALTON T, V49, P11498, DOI 10.1039/D0DT02223C; FISCHER D, 2013, CHEM-EUR J, V19, P4602, DOI 10.1002/CHEM.201203493; GAO YF, 2015, RSC ADV, V5, P54527, DOI 10.1039/C5RA07415K; GOBEL M, 2010, J AM CHEM SOC, V132, P17216, DOI 10.1021/JA106892A; GRUHNE MS, 2021, DALTON T, V50, P10811, DOI 10.1039/D1DT01898A; HE P, 2019, NEW J CHEM, V43, P4235, DOI 10.1039/C8NJ05633A; HU L, 2018, J AM CHEM SOC, V140, P15001, DOI 10.1021/JACS.8B09519; HUMPHREY W, 1996, J MOL GRAPH MODEL, V14, P33, DOI 10.1016/0263-7855(96)00018-5; JOHNSON ER, 2010, J AM CHEM SOC, V132, P6498, DOI 10.1021/JA100936W; KLAP?TKE T.M., 2012, HIGH ENERGY DENSITY; KLAPOTKE TM, 2021, DALTON T, V50, P13656, DOI 10.1039/D1DT02731J; KUMAR D, 2019, RESONANCE, V24, P1253, DOI 10.1007/S12045-019-0893-2; KUMAR D, 2017, NEW J CHEM, V41, P4040, DOI 10.1039/C7NJ00327G; LANG Q, 2021, NEW J CHEM, V45, P20542, DOI 10.1039/D1NJ04188F; LU T, 2012, J COMPUT CHEM, V33, P580, DOI 10.1002/JCC.22885; MA JC, 2021, ANGEW CHEM INT EDIT, V60, P5497, DOI 10.1002/ANIE.202014207; MAYER R., 2002, EXPLOSIVES, V5TH; PRAKASH AGRAWAL J., 2010, HIGH ENERGY MAT; QU YY, 2018, J MATER CHEM A, V6, P1915, DOI 10.1039/C7TA09593G; REICHEL M, 2019, J AM CHEM SOC, V141, P19911, DOI 10.1021/JACS.9B11086; SIFAIN AE, 2017, J CHEM PHYS, V146, DOI 10.1063/1.4978579; SINGH J., 2021, CHEM ENG J, V431; SPACKMAN MA, 2002, CRYSTENGCOMM, V4, P378, DOI 10.1039/B203191B; SPACKMAN MA, 2009, CRYSTENGCOMM, V11, P19, DOI 10.1039/B818330A; STRUNIN VA, 2013, COMBUST EXPLO SHOCK+, V49, P53, DOI 10.1134/S0010508213010061; SUCESKA, 2013, EXPLO5 6 01; TANG J, 2021, MATER CHEM FRONT, V5, P7108, DOI 10.1039/D1QM00916H; TANG YX, 2020, J AM CHEM SOC, V142, P7153, DOI 10.1021/JACS.0C01640; TANG YX, 2016, J MATER CHEM A, V4, P3879, DOI 10.1039/C5TA09803C; TANG YX, 2015, CHEM-EUR J, V21, P11401, DOI 10.1002/CHEM.201501612; TURKER L, 2016, DEF TECHNOL, V12, P1, DOI 10.1016/J.DT.2015.11.002; VAN DER HEIJDEN AEDM, 2004, CRYST GROWTH DES, V4, P999, DOI 10.1021/CG049965A; WANG BS, 2017, J MATER CHEM A, V5, P20867, DOI 10.1039/C7TA05905A; XU X, 2020, RSC ADV, V10, P11939, DOI 10.1039/D0RA01182G; YADAV AK, 2021, MATER CHEM FRONT, V5, P8352, DOI 10.1039/D1QM01365C; YAN TG, 2019, CHEMPLUSCHEM, V84, P1567, DOI 10.1002/CPLU.201900454; YANG JQ, 2018, ACS OMEGA, V3, P9739, DOI 10.1021/ACSOMEGA.8B00614; YANG XM, 2018, CHEM COMMUN, V54, P10296, DOI 10.1039/C8CC05413D; YIN P, 2016, ACCOUNTS CHEM RES, V49, P4, DOI 10.1021/ACS.ACCOUNTS.5B00477; YIN ZY, 2021, NEW J CHEM, V45, P11752, DOI 10.1039/D1NJ01751A; YIN ZY, 2022, CRYST GROWTH DES, V0022; ZEISEL L, 2019, NEW J CHEM, V43, P609, DOI 10.1039/C8NJ05375H; ZHANG JH, 2019, DALTON T, V48, P11848, DOI 10.1039/C9DT02334H; ZHANG Q, 2022, NEW J CHEM, V46, P1489, DOI 10.1039/D1NJ05510K; ZHANG WJ, 2021, CRYSTENGCOMM, V23, P8099, DOI 10.1039/D1CE01275D; ZHAO CD, 2019, PHYS CHEM CHEM PHYS, V21, P15215, DOI 10.1039/C9CP02715G","ENERGETIC PROPERTIES OF BISTETRAZOLE DERIVATIVES ARE IMPROVED BY THE STEP-BY-STEP INTRODUCTION OF FUNCTIONALITIES WHICH IMPROVE HEAT OF FORMATION, DENSITY, AND OXYGEN CONTENT. THE INCORPORATION OF UNSATURATION BETWEEN BIS(1H-TETRAZOL-5-YL) AND BIS(1H-TETRAZOL-1-OL) DERIVATIVES LEADS TO PLANARITY WHICH ENHANCES THE DENSITY OF THE FINAL PRODUCT. IN THIS MANUSCRIPT, WE HAVE SYNTHESIZED COMPOUNDS 1,2-DI(1H-TETRAZOL-5-YL)ETHANE (4), (E)-1,2-DI(1H-TETRAZOL-5-YL)ETHENE (5), AND (E)-5,5'-(ETHENE-1,2-DIYL)BIS(1H-TETRAZOL-1-OL), (6) USING READILY AVAILABLE STARTING MATERIALS. THEIR CORRESPONDING DIHYDROXYLAMMONIUM SALTS 7, 8 AND 9 ARE OBTAINED BY REACTING TWO EQUIVALENTS OF HYDROXYLAMINE (50\% IN WATER). NEW COMPOUNDS ARE ANALYZED USING IR, EA, DSC AND MULTINUCLEAR NMR SPECTROSCOPY (H-1, C-13 AND N-15). THE SOLID-STATE STRUCTURES OF COMPOUNDS 6, 7, 8 AND 9 ARE CONFIRMED BY SINGLE-CRYSTAL X-RAY DIFFRACTION. THE ENERGETIC PERFORMANCES ARE CALCULATED USING THE EXPLO5 (V6.06.02) CODE AND THE SENSITIVITIES TOWARDS EXTERNAL STIMULI SUCH AS FRICTION AND IMPACT ARE DETERMINED ACCORDING TO BAM STANDARD. COMPOUND 6 \(E)-5,5 `-(ETHENE-1,2-DIYL)BIS(1H-TETRAZOL-1-OL)\ EXHIBITS A SURPRISINGLY HIGH DENSITY OF 1.91 G CM(-3) AT 100 K (1.86 G CM(-3) AT 298 K). ITS DETONATION VELOCITY (9017 M S(-1)) IS CONSIDERABLY SUPERIOR TO THOSE OF RDX (8795 M S(-1)), WHICH SUGGESTS IT IS A COMPETITIVE HIGH-ENERGY-DENSITY MATERIAL.","THOMAS GRAHAM HOUSE, SCIENCE PARK, MILTON RD, CAMBRIDGE CB4 0WF, CAMBS, ENGLAND","IDAHO; UNIVERSITY OF IDAHO; MICHIGAN STATE UNIVERSITY",NA,"JSHREEVE@UIDAHO.EDU","2022-12-01","2Z4MW","10.1039/d2ma00664b","JUN 2022","2633-5409",NA,NA,"NATIONAL SCIENCE FOUNDATION (MRI PROGRAM) [1919565]; FLUORINE-19 FUND","THE DIFFRACTOMETER (RIGAKU SYNERGY S) FOR SC-XRD WAS PURCHASED WITH SUPPORT FROM THE NATIONAL SCIENCE FOUNDATION (MRI PROGRAM) UNDER GRANT NO. 1919565. WE ARE GRATEFUL TO THE FLUORINE-19 FUND.",NA,"MATER. ADV.","MATERIALS ADVANCES","ENGLISH","JUL 18","49","14","SHREEVE, JEAN'NE/0000-0001-8622-4897 STAPLES, RICHARD/0000-0003-2760-769X","6062-6068","ROYAL SOC CHEMISTRY","MATERIALS SCIENCE",0,"ENGINEERING BISTETRAZOLES: (E)-5,5 `-(ETHENE-1,2-DIYL)BIS(1H-TETRAZOL-1-OL) AS A NEW PLANAR HIGH-ENERGY-DENSITY MATERIAL","ARTICLE","WOS000818950600001","5","5","3","MATERIALS SCIENCE, MULTIDISCIPLINARY","EMERGING SOURCES CITATION INDEX (ESCI)",2022,"SHREEVE, JM (CORRESPONDING AUTHOR), UNIV IDAHO, DEPT CHEM, MOSCOW, ID 83844 USA","ISI","UNIV IDAHO;UNIV IDAHO;MICHIGAN STATE UNIV","UNIV IDAHO","SINGH J, 2022, MATER ADV","SINGH J, 2022, MATER ADV","USA",3,0
"SMITH AM, 2019, SCI REP","SMITH AM;POSFAI M;ROHDEN M;GONZALEZ AD;DUENAS-OSORIO L;D'SOUZA RM",NA,"DESIGN; RESILIENCE","SMITH, AM (CORRESPONDING AUTHOR), UNIV CALIF DAVIS, DEPT COMP SCI, DAVIS, CA 95616 USA.; SMITH, AM (CORRESPONDING AUTHOR), UNIV CALIF DAVIS, COMPLEX SCI CTR, DAVIS, CA 95616 USA.; SMITH, ANDREW M.; POSFAI, MARTON; ROHDEN, MARTIN; D'SOUZA, RAISSA M., UNIV CALIF DAVIS, DEPT COMP SCI, DAVIS, CA 95616 USA.; SMITH, ANDREW M.; POSFAI, MARTON; ROHDEN, MARTIN; D'SOUZA, RAISSA M., UNIV CALIF DAVIS, COMPLEX SCI CTR, DAVIS, CA 95616 USA.; GONZALEZ, ANDRES D., UNIV OKLAHOMA, SCH IND \& SYST ENGN, NORMAN, OK 73019 USA.; DUENAS-OSORIO, LEONARDO, RICE UNIV, DEPT CIVIL \& ENVIRONM ENGN, HOUSTON, TX 77005 USA.; D'SOUZA, RAISSA M., UNIV CALIF DAVIS, DEPT MECH \& AEROSP ENGN, DAVIS, CA 95616 USA.; D'SOUZA, RAISSA M., SANTA FE INST, SANTA FE, NM 87501 USA.","ACHLIOPTAS D, 2009, SCIENCE, V323, P1453, DOI 10.1126/SCIENCE.1167782; ALBERT R, 2000, NATURE, V406, P378, DOI 10.1038/35019019; ASH J, 2007, PHYSICA A, V380, P673, DOI 10.1016/J.PHYSA.2006.12.058; BALAKRISHNAN A, 1989, OPER RES, V37, P716, DOI 10.1287/OPRE.37.5.716; CHAPMAN A, 2017, IEEE DECIS CONTR P, DOI 10.1109/CDC.2017.8263712; CLUSELLA P, 2016, PHYS REV LETT, V117, DOI 10.1103/PHYSREVLETT.117.208301; COHEN R, 2000, PHYS REV LETT, V85, P4626, DOI 10.1103/PHYSREVLETT.85.4626; D'SOUZA RM, 2017, SCIENCE, V358, P860, DOI 10.1126/SCIENCE.AAQ0474; D'SOUZA RM, 2015, NAT PHYS, V11, P531, DOI 10.1038/NPHYS3378; DI MURO MA, 2016, SCI REP-UK, V6, DOI 10.1038/SREP22834; FEMA, 2013, TECH REP; GALLO M, 2010, EUR J OPER RES, V201, P144, DOI 10.1016/J.EJOR.2009.02.026; GOMEZ C., 2019, RISK ANAL; GONZALEZ A, 2017, THESIS; GONZALEZ AD., 2016, 6 ASIAN PACIFIC S ST, P544; GONZALEZ AD, 2017, COMPUT-AIDED CIV INF, V32, P991, DOI 10.1111/MICE.12314; GONZALEZ AD, 2016, COMPUT-AIDED CIV INF, V31, P334, DOI 10.1111/MICE.12171; HOLME PETTER, 2002, PHYS REV E STAT NONLIN SOFT MATTER PHYS, V65, P066109; HU F., 2016, SCI REPORTS, V6; HUTCHEON N., 2013, IEEE GRENOBLE POWERT, P1, DOI DOI 10.1109/PTC.2013.6652178; JOHNSON DS, 1978, NETWORKS, V8, P279, DOI 10.1002/NET.3230080402; KRAPIVSKY P., 2010, KINETIC VIEW STAT PH; LATORA V, 2001, PHYS REV LETT, V87, DOI 10.1103/PHYSREVLETT.87.198701; LI DQ, 2015, RELIAB ENG SYST SAFE, V142, P556, DOI 10.1016/J.RESS.2015.05.021; LI DQ, 2014, SCI REP-UK, V4, DOI 10.1038/SREP05381; LI J, 2016, PHYSICA A, V453, P84, DOI 10.1016/J.PHYSA.2016.01.087; MAJDANDZIC A, 2014, NAT PHYS, V10, P34, DOI 10.1038/NPHYS2819, 10.1038/NPHYS2819; MOTTER AE, 2002, PHYS REV E, V66, DOI 10.1103/PHYSREVE.66.065102; MUREDDU M, 2016, SCI REP-UK, V6, DOI 10.1038/SREP34797; NATIONAL RESEARCH COUNCIL, 2012, TERR EL POW DEL SYST; NURRE SG, 2012, EUR J OPER RES, V223, P794, DOI 10.1016/J.EJOR.2012.07.010; PANTELI M, 2016, IEEE T SMART GRID, V7, P2913, DOI 10.1109/TSG.2016.2535228; POORZAHEDY H, 2007, EUR J OPER RES, V182, P578, DOI 10.1016/J.EJOR.2006.07.038; QUATTROCIOCCHI W, 2014, PLOS ONE, V9, DOI 10.1371/JOURNAL.PONE.0087986; RUDNICK H, 2011, IEEE POWER ENERGY M, V9, P37, DOI 10.1109/MPE.2010.939948; SCHULTZ P, 2014, EUR PHYS J-SPEC TOP, V223, P2593, DOI 10.1140/EPJST/E2014-02279-6; SHANG Y, 2016, SCI REPORTS, V6; SMITH A. M., 2017, RISK ANAL; VAN MIEGHEM P., 2010, GRAPH SPECTRA COMPLE; WANG ZF, 2010, IEEE T SMART GRID, V1, P28, DOI 10.1109/TSG.2010.2044814; ZHAO J, 2016, NAT COMMUN, V7, DOI DOI 10.1109/ISSSR.2016.20; ZHONG J., 2018, PHYSICA A, V514, P884","RESTORING OPERATION OF CRITICAL INFRASTRUCTURE SYSTEMS AFTER CATASTROPHIC EVENTS IS AN IMPORTANT ISSUE, INSPIRING WORK IN MULTIPLE FIELDS, INCLUDING NETWORK SCIENCE, CIVIL ENGINEERING, AND OPERATIONS RESEARCH. WE CONSIDER THE PROBLEM OF FINDING THE OPTIMAL ORDER OF REPAIRING ELEMENTS IN POWER GRIDS AND SIMILAR INFRASTRUCTURE. MOST EXISTING METHODS EITHER ONLY CONSIDER SYSTEM NETWORK STRUCTURE, POTENTIALLY IGNORING IMPORTANT FEATURES, OR INCORPORATE COMPONENT LEVEL DETAILS LEADING TO COMPLEX OPTIMIZATION PROBLEMS WITH LIMITED SCALABILITY. WE AIM TO NARROW THE GAP BETWEEN THE TWO APPROACHES. ANALYZING REALISTIC RECOVERY STRATEGIES, WE IDENTIFY OVER- AND UNDERSUPPLY PENALTIES OF COMMODITIES AS PRIMARY CONTRIBUTIONS TO RECONSTRUCTION COST, AND WE DEMONSTRATE TRADITIONAL NETWORK SCIENCE METHODS, WHICH MAXIMIZE THE LARGEST CONNECTED COMPONENT, ARE COST INEFFICIENT. WE PROPOSE A NOVEL COMPETITIVE PERCOLATION RECOVERY MODEL ACCOUNTING FOR NODE DEMAND AND SUPPLY, AND NETWORK STRUCTURE. OUR MODEL WELL APPROXIMATES REALISTIC RECOVERY STRATEGIES, SUPPRESSING GROWTH OF THE LARGEST CONNECTED COMPONENT THROUGH A PROCESS ANALOGOUS TO EXPLOSIVE PERCOLATION. USING SYNTHETIC POWER GRIDS, WE INVESTIGATE THE EFFECT OF NETWORK CHARACTERISTICS ON RECOVERY PROCESS EFFICIENCY. WE LEARN THAT HIGH STRUCTURAL REDUNDANCY ENABLES REDUCED TOTAL COST AND FASTER RECOVERY, HOWEVER, REQUIRES MORE INFORMATION AT EACH RECOVERY STEP. WE ALSO CONFIRM THAT DECENTRALIZED SUPPLY IN NETWORKS GENERALLY BENEFITS RECOVERY EFFORTS.","MACMILLAN BUILDING, 4 CRINAN ST, LONDON N1 9XW, ENGLAND","UNIVERSITY OF CALIFORNIA SYSTEM; UNIVERSITY OF CALIFORNIA DAVIS; UNIVERSITY OF CALIFORNIA SYSTEM; UNIVERSITY OF CALIFORNIA DAVIS; UNIVERSITY OF OKLAHOMA SYSTEM; UNIVERSITY OF OKLAHOMA - NORMAN; RICE UNIVERSITY; UNIVERSITY OF CALIFORNIA SYSTEM; UNIVERSITY OF CALIFORNIA DAVIS; THE SANTA FE INSTITUTE","11843","AMSMI@UCDAVIS.EDU","2022-12-01","IQ3UW","10.1038/s41598-019-48036-0",NA,NA,NA,NA,"U.S. ARMY RESEARCH LABORATORY UNDER MURI AWARD [W911NF-13-1-0340]; U.S. ARMY RESEARCH OFFICE UNDER MURI AWARD [W911NF-13-1-0340]; DARPA [W911NF-17-1-0077]; CENTER FOR RISK-BASED COMMUNITY RESILIENCE PLANNING - NATIONAL INSTITUTE OF STANDARDS AND TECHNOLOGY (NIST) [70NANB15H044]","WE GRATEFULLY ACKNOWLEDGE SUPPORT FROM THE U.S. ARMY RESEARCH LABORATORY AND THE U.S. ARMY RESEARCH OFFICE UNDER MURI AWARD NUMBER W911NF-13-1-0340, FROM DARPA AWARD W911NF-17-1-0077, AND FROM THE CENTER FOR RISK-BASED COMMUNITY RESILIENCE PLANNING, FUNDED BY THE NATIONAL INSTITUTE OF STANDARDS AND TECHNOLOGY (NIST) UNDER COOPERATIVE AGREEMENT NO. 70NANB15H044.","2045-2322","SCI REP","SCIENTIFIC REPORTS","ENGLISH","AUG 14","42",NA,"GONZLEZ, ANDRS D./0000-0003-0613-5224",NA,"NATURE PUBLISHING GROUP","SCIENCE \& TECHNOLOGY - OTHER TOPICS",4,"COMPETITIVE PERCOLATION STRATEGIES FOR NETWORK RECOVERY","ARTICLE","WOS000480678100042","3","12","9","MULTIDISCIPLINARY SCIENCES","SCIENCE CITATION INDEX EXPANDED (SCI-EXPANDED)",2019,"SMITH, AM (CORRESPONDING AUTHOR), UNIV CALIF DAVIS, DEPT COMP SCI, DAVIS, CA 95616 USA","ISI","UNIV CALIF DAVIS;UNIV CALIF DAVIS;UNIV CALIF DAVIS;UNIV CALIF DAVIS;UNIV OKLAHOMA;RICE UNIV;UNIV CALIF DAVIS;SANTA FE INST","UNIV CALIF DAVIS","SMITH AM, 2019, SCI REP","SMITH AM, 2019, SCI REP","USA",6,0
