"","AU","DE","ID","C1","CR","AB","PA","affiliations","AR","EM","da","GA","DI","earlyaccessdate","eissn","esi.highly.cited.paper","esi.hot.paper","FU","FX","SN","JI","SO","LA","month","NR","PN","orcid.numbers","PP","PU","SC","TC","TI","DT","UT","usage.count.last.180.days","U2","VL","web.of.science.categories.","web.of.science.index","PY","RP","DB","AU_UN","AU1_UN","SR_FULL","SR","CO","AU_Count","LocalCitations"
"ANDERSON MJ, 2020, BIOINSPIR BIOMIM","ANDERSON MJ;SULLIVAN JG;HORIUCHI TK;FULLER SB;DANIEL TL","BIOHYBRID; FLIGHT; BIOINSPIRED; ROBOT; CHEMICAL SENSING","MOTH MANDUCA-SEXTA; RECEPTOR-CELLS; ANTENNAL LOBE; SPHINX MOTH;; PHEROMONE; RESPONSES; FLIGHT; PLUMES","DANIEL, TL (CORRESPONDING AUTHOR), UNIV WASHINGTON, DEPT MECH ENGN, SEATTLE, WA 98195 USA.; DANIEL, TL (CORRESPONDING AUTHOR), UNIV WASHINGTON, DEPT BIOL, SEATTLE, WA 98195 USA.; ANDERSON, MELANIE J.; FULLER, SAWYER B.; DANIEL, THOMAS L., UNIV WASHINGTON, DEPT MECH ENGN, SEATTLE, WA 98195 USA.; SULLIVAN, JOSEPH G., UNIV WASHINGTON, DEPT ELECT \& COMP ENGN, SEATTLE, WA 98195 USA.; HORIUCHI, TIMOTHY K., UNIV MARYLAND, DEPT ELECT \& COMP ENGN, COLLEGE PK, MD 20742 USA.; FULLER, SAWYER B., UNIV WASHINGTON, PAUL G ALLEN SCH COMP SCI, SEATTLE, WA 98195 USA.; DANIEL, THOMAS L., UNIV WASHINGTON, DEPT BIOL, SEATTLE, WA 98195 USA.","ANDERSON MJ, 2019, IEEE INT C INT ROBOT, P6077, DOI 10.1109/IROS40897.2019.8968589; ANDO N, 2017, ARTHROPOD STRUCT DEV, V46, P723, DOI 10.1016/J.ASD.2017.02.003; ANTON S, 1995, J COMP PHYSIOL A, V176, P773, DOI 10.1007/BF00192625; BUDICK SA, 2006, J EXP BIOL, V209, P3001, DOI 10.1242/JEB.02305; BURGUES J, 2019, SENSORS-BASEL, V19, DOI 10.3390/S19030478; DALY DC, 2010, IEEE J SOLID-ST CIRC, V45, P153, DOI 10.1109/JSSC.2009.2034433; FANDINO RA, 2019, P NATL ACAD SCI USA, V116, P15677, DOI 10.1073/PNAS.1902089116; FRASER AM, 2003, J CHEM ECOL, V29, P1813, DOI 10.1023/A:1024898127549; FU W., 2020, ARXIV190911236; FULLER SB, 2014, P NATL ACAD SCI USA, V111, PE1182, DOI 10.1073/PNAS.1323529111; GANDER MW, 2017, NAT COMMUN, V8, DOI 10.1038/NCOMMS15459; HANSSON BS, 2003, J COMP PHYSIOL A, V189, P301, DOI 10.1007/S00359-003-0403-5; HARVEY DJ, 2008, IEEE T ROBOT, V24, P307, DOI 10.1109/TRO.2007.912090; HERR HM, 2012, P ROY SOC B-BIOL SCI, V279, P457, DOI 10.1098/RSPB.2011.1194; HERRON J, 2015, I IEEE EMBS C NEUR E, P844, DOI 10.1109/NER.2015.7146755; HUANG JV, 2019, BIOINSPIR BIOMIM, V14, DOI 10.1088/1748-3190/AB3B23; KUWANA Y, 1999, BIOSENS BIOELECTRON, V14, P195, DOI 10.1016/S0956-5663(98)00106-7; LAHONDERE C, 2020, P NATL ACAD SCI USA, V117, P708, DOI 10.1073/PNAS.1910589117; LAN B, 2019, SENSORS-BASEL, V19, DOI 10.3390/S19204574; LEE JK, 1990, J NEUROCYTOL, V19, P519, DOI 10.1007/BF01257241; LI Y, 2018, SOFT ROBOT, V5, P365, DOI 10.1089/SORO.2017.0118; LUO B, 2018, IEEE T INSTRUM MEAS, V67, P137, DOI 10.1109/TIM.2017.2759378; MAFRANETO A, 1994, NATURE, V369, P142, DOI 10.1038/369142A0; MARTINEZ D, 2014, JOVE-J VIS EXP, DOI 10.3791/51704; NEUMANN PP, 2013, ADV ROBOTICS, V27, P725, DOI 10.1080/01691864.2013.779052; REISENMAN CE, 2013, J CHEM ECOL, V39, P76, DOI 10.1007/S10886-012-0228-1; RICOTTI L, 2017, SCI ROBOT, V2, DOI 10.1126/SCIROBOTICS.AAQ0495; RIFFELL JA, 2008, J CHEM ECOL, V34, P837, DOI 10.1007/S10886-008-9490-7; SANE SP, 2007, SCIENCE, V315, P863, DOI 10.1126/SCIENCE.1133598; SANE SP, 2006, J EXP BIOL, V209, P43, DOI 10.1242/JEB.01958; SATO H, 2009, FRONT INTEGR NEUROSC, V3, DOI 10.3389/NEURO.07.024.2009; SHIELDS VDC, 2001, J COMP PHYSIOL A, V186, P1135, DOI 10.1007/S003590000165; SHIGAKI S, 2018, ADV ROBOTICS, V32, P945, DOI 10.1080/01691864.2018.1511473; SHIGAKI S, 2018, SENSORS-BASEL, V18, DOI 10.3390/S18113720; SPEHR M, 2009, J NEUROCHEM, V109, P1570, DOI 10.1111/J.1471-4159.2009.06085.X; TSANG WM, 2012, J NEUROSCI METH, V204, P355, DOI 10.1016/J.JNEUMETH.2011.11.026; VOGES N, 2014, PLOS COMPUT BIOL, V10, DOI 10.1371/JOURNAL.PCBI.1003861; WILLIS MA, 2013, J COMP PHYSIOL A, V199, P1015, DOI 10.1007/S00359-013-0856-0; XU NW, 2020, SCI ADV, V6, DOI 10.1126/SCIADV.AAZ3194","BIOHYBRID SYSTEMS INTEGRATE LIVING MATERIALS WITH SYNTHETIC DEVICES, EXPLOITING THEIR RESPECTIVE ADVANTAGES TO SOLVE CHALLENGING ENGINEERING PROBLEMS. ONE CHALLENGE OF CRITICAL IMPORTANCE TO SOCIETY IS DETECTING AND LOCALIZING AIRBORNE VOLATILE CHEMICALS. MANY FLYING ANIMALS DEPEND THEIR ABILITY TO DETECT AND LOCATE THE SOURCE OF AERIAL CHEMICAL PLUMES FOR FINDING MATES AND FOOD SOURCES. A ROBOT WITH COMPARABLE CAPABILITY COULD REDUCE HUMAN HAZARD AND DRASTICALLY IMPROVE PERFORMANCE ON TASKS SUCH AS LOCATING DISASTER SURVIVORS, HAZARDOUS GAS LEAKS, INCIPIENT FIRES, OR EXPLOSIVES. THREE ADVANCES ARE NEEDED BEFORE THEY CAN RIVAL THEIR BIOLOGICAL COUNTERPARTS: (1) A CHEMICAL SENSOR WITH A MUCH FASTER RESPONSE TIME THAT NEVERTHELESS SATISFIES THE SIZE, WEIGHT, AND POWER CONSTRAINTS OF FLIGHT, (2) A DESIGN, SENSOR SUITE, AND CONTROL SYSTEM THAT ALLOWS IT TO MOVE TOWARD THE SOURCE OF A PLUME FULLY AUTONOMOUSLY WHILE NAVIGATING OBSTACLES, AND (3) THE ABILITY TO DETECT THE PLUME WITH HIGH SPECIFICITY AND SENSITIVITY AMONG THE ASSORTMENT OF CHEMICALS THAT INVARIABLY EXIST IN THE AIR. HERE WE ADDRESS THE FIRST TWO, INTRODUCING A HUMAN-SAFE PALM-SIZED AIR VEHICLE EQUIPPED WITH THE ODOR-SENSING ANTENNA OF AN INSECT, THE FIRST ODOR-SENSING BIOHYBRID ROBOT SYSTEM TO FLY. USING THIS SENSOR ALONG WITH A SUITE OF ADDITIONAL NAVIGATIONAL SENSORS, AS WELL AS PASSIVE WIND FINS, OUR ROBOT ORIENTS UPWIND AND NAVIGATES AUTONOMOUSLY TOWARD THE SOURCE OF AIRBORNE PLUMES. OUR ROBOT IS THE FIRST FLYING BIOHYBRID SYSTEM TO SUCCESSFULLY PERFORM ODOR LOCALIZATION IN A CONFINED SPACE, AND IT IS ABLE TO DO SO WHILE DETECTING AND AVOIDING OBSTACLES IN ITS FLIGHT PATH. WE SHOW THAT INSECT ANTENNAE RESPOND MORE QUICKLY THAN METAL OXIDE GAS SENSORS, ENABLING ODOR LOCALIZATION AT AN IMPROVED SPEED OVER PREVIOUS FLYING ROBOTS. BY USING THE INSECT ANTENNAE, WE ANTICIPATE A FEASIBLE PATH TOWARD IMPROVED CHEMICAL SPECIFICITY AND SENSITIVITY BY LEVERAGING RECENT ADVANCES IN GENE EDITING.","TEMPLE CIRCUS, TEMPLE WAY, BRISTOL BS1 6BE, ENGLAND","UNIVERSITY OF WASHINGTON; UNIVERSITY OF WASHINGTON SEATTLE; UNIVERSITY OF WASHINGTON; UNIVERSITY OF WASHINGTON SEATTLE; UNIVERSITY SYSTEM OF MARYLAND; UNIVERSITY OF MARYLAND COLLEGE PARK; UNIVERSITY OF WASHINGTON; UNIVERSITY OF WASHINGTON SEATTLE; UNIVERSITY OF WASHINGTON; UNIVERSITY OF WASHINGTON SEATTLE","026002","MELANIEA@UW.EDU JGS6156@UW.EDU TIMMER@ISR.UMD.EDU MINSTER@UW.EDU DANIELT@UW.EDU","2022-12-01","QG4NN","10.1088/1748-3190/abbd81",NA,"1748-3190",NA,NA,"NATIONAL DEFENSE SCIENCE AND ENGINEERING GRADUATE FELLOWSHIP; WASHINGTON RESEARCH FOUNDATION; JOAN AND RICHARD KOMEN ENDOWED CHAIR; AIR FORCE OFFICE OF SCIENTIFIC RESEARCH (AFOSR) [FA9550-14-1-0398]","THIS WORK HAS BEEN SUPPORTED BY THE NATIONAL DEFENSE SCIENCE AND ENGINEERING GRADUATE FELLOWSHIP, THE WASHINGTON RESEARCH FOUNDATION, THE JOAN AND RICHARD KOMEN ENDOWED CHAIR, AND THE AIR FORCE OFFICE OF SCIENTIFIC RESEARCH (AFOSR), GRANT NOS. FA9550-14-1-0398. WE WISH TO THANK DRS. JENNIFER TALLEY, KEVIN BRINK, JEFFREY RIFFELL AND MARK WILLIS FOR SUGGESTIONS AND ADVICE THROUGHOUT THE PREPARATION OF THIS WORK. MATTHEW MANN AND AMANUEL MAMO BOTH ASSISTED WITH DATA COLLECTION.","1748-3182","BIOINSPIR. BIOMIM.","BIOINSPIRATION \& BIOMIMETICS","ENGLISH","MAR","39","2","ANDERSON, MELANIE/0000-0001-8555-6857",NA,"IOP PUBLISHING LTD","ENGINEERING; MATERIALS SCIENCE; ROBOTICS",7,"A BIO-HYBRID ODOR-GUIDED AUTONOMOUS PALM-SIZED AIR VEHICLE","ARTICLE","WOS000617564100001","4","18","16","ENGINEERING, MULTIDISCIPLINARY; MATERIALS SCIENCE, BIOMATERIALS; ROBOTICS","SCIENCE CITATION INDEX EXPANDED (SCI-EXPANDED)",2020,"DANIEL, TL (CORRESPONDING AUTHOR), UNIV WASHINGTON, DEPT MECH ENGN, SEATTLE, WA 98195 USA","ISI","UNIV WASHINGTON;UNIV WASHINGTON;UNIV WASHINGTON;UNIV WASHINGTON;UNIV MARYLAND;UNIV WASHINGTON;UNIV WASHINGTON","UNIV WASHINGTON","ANDERSON MJ, 2020, BIOINSPIR BIOMIM","ANDERSON MJ, 2020, BIOINSPIR BIOMIM","USA",5,0
"BESKARDES GD, 2018, GEOPHYS J INT","BESKARDES GD;WEISS CJ","ELECTRICAL PROPERTIES; FRACTURE AND FLOW; NUMERICAL APPROXIMATIONS AND; ANALYSIS","DUAL-POROSITY MODEL; LENGTH DISTRIBUTION; FLOW-ANALYSIS; POROUS-MEDIA;; RESISTIVITY; ROCK; PERMEABILITY; RESERVOIR; SYSTEMS; SIMULATION","BESKARDES, GD (CORRESPONDING AUTHOR), SANDIA NATL LABS, DEPT GEOPHYS, ALBUQUERQUE, NM 87123 USA.; BESKARDES, G. D.; WEISS, C. J., SANDIA NATL LABS, DEPT GEOPHYS, ALBUQUERQUE, NM 87123 USA.; WEISS, C. J., UNIV NEW MEXICO, DEPT EARTH \& PLANETARY SCI, ALBUQUERQUE, NM 87106 USA.","ANDERSSON J, 1987, WATER RESOUR RES, V23, P1876, DOI 10.1029/WR023I010P01876; ANDERSSON J, 1984, WATER RESOUR RES, V20, P79, DOI 10.1029/WR020I001P00079; BEAR J., 2012, FLOW CONTAMINANT TRA; BOGDANOV II, 2003, WATER RESOUR RES, V39, DOI 10.1029/2001WR000756; BONNET E, 2001, REV GEOPHYS, V39, P347, DOI 10.1029/1999RG000074; BUSBY JP, 2000, GEOPHYS PROSPECT, V48, P677, DOI 10.1046/J.1365-2478.2000.00208.X; CACAS MC, 1990, WATER RESOUR RES, V26, P479, DOI 10.1029/WR026I003P00479; COMMER M, 2015, GEOPHYSICS, V80, PE147, DOI 10.1190/GEO2014-0324.1; DAVY P, 1993, J GEOPHYS RES-SOL EA, V98, P12141, DOI 10.1029/93JB00372; DE DREUZY JR, 2013, COMPUT GEOSCI-UK, V50, P59, DOI 10.1016/J.CAGEO.2012.07.025; DE DREUZY JR, 2001, WATER RESOUR RES, V37, P2079, DOI 10.1029/2001WR900010; GONG J, 2017, PETROL SCI, V14, P138, DOI 10.1007/S12182-016-0132-3; GUTIERREZ M, 2015, J ROCK MECH GEOTECH, V7, P626, DOI 10.1016/J.JRMGE.2015.07.006; HABER E., 2016, SEG TECHN PROGR EXP, P959; HATTON CG, 1994, NATURE, V367, P160, DOI 10.1038/367160A0; HEAGY L., 2016, 86 ANN INT M SEG, P932, DOI DOI 10.1190/SEGAM2016-13868475.1; HOVERSTEN GM, 2015, GEOPHYS PROSPECT, V63, P1508, DOI 10.1111/1365-2478.12300; KOUDINA N, 1998, PHYS REV E, V57, P4466, DOI 10.1103/PHYSREVE.57.4466; LANE JW, 1995, GROUND WATER, V33, P476, DOI 10.1111/J.1745-6584.1995.TB00304.X; LEE SH, 2001, WATER RESOUR RES, V37, P443, DOI 10.1029/2000WR900340; LEGARTH B, 2005, INT J ROCK MECH MIN, V42, P1028, DOI 10.1016/J.IJRMMS.2005.05.014; LEI QH, 2017, COMPUT GEOTECH, V85, P151, DOI 10.1016/J.COMPGEO.2016.12.024; LI LY, 2008, SPE RESERV EVAL ENG, V11, P750, DOI 10.2118/103901-PA; LI Y, 2002, GEOPHYS J INT, V151, P924, DOI 10.1046/J.1365-246X.2002.01819.X; LONG JCS, 1987, WATER RESOUR RES, V23, P1201, DOI 10.1029/WR023I007P01201; LONG JCS, 1982, WATER RESOUR RES, V18, P645, DOI 10.1029/WR018I003P00645; LOWRY T, 1989, GEOPHYSICS, V54, P766, DOI 10.1190/1.1442704; MOURZENKO VV, 2011, MATH COMPUT SIMULAT, V81, P2270, DOI 10.1016/J.MATCOM.2010.12.014; MUSTAPHA H, 2011, FINITE ELEM ANAL DES, V47, P434, DOI 10.1016/J.FINEL.2010.12.003; POLLARD DD, FRACTURE MECH ROCK, P277; ROBINSON J, 2015, GEOPHYSICS, V80, PE49, DOI 10.1190/GEO2014-0138.1; ROBINSON PC, 1983, J PHYS A-MATH GEN, V16, P605, DOI 10.1088/0305-4470/16/3/020; ROUBINET D, 2014, J GEOPHYS RES-SOL EA, V119, P767, DOI 10.1002/2013JB010668; SANZ VC, 2017, GEOPHYS J INT, V209, P1099, DOI 10.1093/GJI/GGX080; SERAN E, 2017, EARTH SPACE SCI, V4, P91, DOI 10.1002/2016EA000241; SHEN JS, 2009, PETROL SCI, V6, P127, DOI 10.1007/S12182-009-0021-0; SNOW DT, 1970, INT J ROCK MECH MIN, V7, P23, DOI 10.1016/0148-9062(70)90025-2; SUN QT, 2017, IEEE T GEOSCI REMOTE, V55, P6566, DOI 10.1109/TGRS.2017.2730039; TAYLOR RW, 1988, GROUND WATER, V26, P464, DOI 10.1111/J.1745-6584.1988.TB00413.X; TELFORD W. M., 1990, APPL GEOPHYS, V2ND; TSANG CF, 1998, REV GEOPHYS, V36, P275, DOI 10.1029/97RG03319; TSANG CF, 2015, WATER RESOUR RES, V51, P6923, DOI 10.1002/2015WR017641; TSANG YW, 1996, WATER RESOUR RES, V32, P3077, DOI 10.1029/96WR01397; UCHIDA M., 1994, 9409 ICR SKB INT COO; UM ES, 2015, GEOPHYS J INT, V202, P901, DOI 10.1093/GJI/GGV193; WEISS C. J., 2001, 71 ANN INT M SEG, P1451, DOI 10.1190/1.1816377, DOI 10.1190/1.1816377; WEISS C.J., 2018, P 88 ANN INT M SEG; WEISS CJ, 2017, GEOPHYSICS, V82, PE155, DOI 10.1190/GEO2017-0058.1; XU CS, 2010, COMPUT GEOSCI-UK, V36, P292, DOI 10.1016/J.CAGEO.2009.05.012; ZHANG QH, 2016, J HYDROL, V542, P790, DOI 10.1016/J.JHYDROL.2016.09.054; ZHANG QH, 2015, J HYDROL, V529, P890, DOI 10.1016/J.JHYDROL.2015.08.065","DETERMINATION OF THE GEOMETRICAL PROPERTIES OF FRACTURES PLAYS A CRITICAL ROLE IN MANY ENGINEERING PROBLEMS TO ASSESS THE CURRENT HYDROLOGICAL AND MECHANICAL STATES OF GEOLOGICAL MEDIA AND TO PREDICT THEIR FUTURE STATES. HOWEVER, NUMERICAL MODELLING OF GEOELECTRICAL RESPONSES IN REALISTIC FRACTURED MEDIA HAS BEEN CHALLENGING DUE TO THE EXPLOSIVE COMPUTATIONAL COST IMPOSED BY THE EXPLICIT DISCRETIZATIONS OF FRACTURES AT MULTIPLE LENGTH SCALES, WHICH OFTEN BRINGS ABOUT A TRADE-OFF BETWEEN COMPUTATIONAL EFFICIENCY AND GEOLOGICAL REALISM. HERE, WE USE THE HIERARCHICAL FINITE ELEMENT METHOD (WEISS, 2017) TO MODEL THE ELECTROSTATIC RESPONSE OF REALISTICALLY COMPLEX 3-D CONDUCTIVE FRACTURE NETWORKS WITH MINIMAL COMPUTATIONAL COST. THIS FINITE ELEMENT APPROACH UTILIZES A NOVEL PARAMETRIZATION OF ELECTRICAL CONDUCTIVITY IN 3-D CONDUCTING MEDIA THAT ALLOWS ASSIGNMENT OF ELECTRICAL PROPERTIES AT EACH HIERARCHICAL COMPONENT OF A FINITE VOLUMETRIC ELEMENT (1-D EDGES, 2-D FACETS AND 3-D TETRAHEDRA) WITHIN AN UNSTRUCTURED TETRAHEDRA MESH. BY EMPLOYING THIS HIERARCHICAL MATERIAL MODEL CONCEPT IN THE FINITE ELEMENT ANALYSIS, 3-D FRACTURES CAN BE EXPLICITLY REPRESENTED BY CONNECTED FACET ELEMENTS OR LINEAR GEOLOGICAL FEATURES AS WELL AS INFRASTRUCTURES SUCH AS BOREHOLE CASINGS, RAILS, PIPES CAN BE EXPLICITLY REPRESENTED IN FORM OF CONNECTED EDGES IN FINITE ELEMENT MESH, AND THEREFORE THE NEED OF MESH REFINEMENT DUE TO VOLUMETRICALLY INSIGNIFICANT STRUCTURES CAN BE DRASTICALLY REDUCED. IN THIS STUDY, STOCHASTICALLY GENERATED, COMPLEX 3-D FRACTURE NETWORK MODELS ARE CONSIDERED TO BETTER UNDERSTAND THE RELATIONSHIP BETWEEN THE HETEROGENEITY OF FRACTURE NETWORK AND THE RESULTING DIRECT CURRENT (DC) RESISTIVITY RESPONSES. WE MAINLY FOCUS ON THE EFFECTS OF FRACTURE LENGTH AND APERTURE DISTRIBUTIONS ON THE AZIMUTHAL VARIATIONS IN DC RESISTIVITY. OUR NUMERICAL RESULTS INDICATE THAT CONDUCTIVE FRACTURE NETWORKS WITH HIGH NETWORK CONNECTIVITY RESULT IN ANOMALOUSLY LOW APPARENT RESISTIVITY VALUES WITH STRONG AZIMUTHAL DEPENDENCE IN COMPARISON WITH NETWORKS WITH LOW NETWORK CONNECTIVITY. MOREOVER, OUR RESULTS SHOW THAT WHILE THE FRACTURE SIZE-APERTURE CORRELATION HAS A STRONG INFLUENCE ON DC RESISTIVITY RESPONSES WHEN THE FRACTURE NETWORK IS WELL CONNECTED, THE INFLUENCE OF APERTURE IS MARGINAL FOR FRACTURE NETWORKS WITH POOR NETWORK CONNECTIVITY.","GREAT CLARENDON ST, OXFORD OX2 6DP, ENGLAND","UNITED STATES DEPARTMENT OF ENERGY (DOE); SANDIA NATIONAL LABORATORIES; UNIVERSITY OF NEW MEXICO",NA,"GDBESKA@SANDIA.GOV","2022-12-01","GO0SF","10.1093/gji/ggy234",NA,"1365-246X",NA,NA,"U.S. DEPARTMENT OF ENERGY'S NATIONAL NUCLEAR SECURITY ADMINISTRATION [DE-NA-0003525]; SANDIA NATIONAL LABORATORIES LDRD PROGRAM","SANDIA NATIONAL LABORATORIES IS A MULTIMISSION LABORATORY MANAGED AND OPERATED BY NATIONAL TECHNOLOGY AND ENGINEERING SOLUTIONS OF SANDIA, LLC., A WHOLLY OWNED SUBSIDIARY OF HONEYWELL INTERNATIONAL, INC., FOR THE U.S. DEPARTMENT OF ENERGY'S NATIONAL NUCLEAR SECURITY ADMINISTRATION UNDER CONTRACT DE-NA-0003525. THIS PAPER DESCRIBES OBJECTIVE TECHNICAL RESULTS AND ANALYSIS. ANY SUBJECTIVE VIEWS OR OPINIONS THAT MIGHT BE EXPRESSED IN THE PAPER DO NOT NECESSARILY REPRESENT THE VIEWS OF THE U.S. DEPARTMENT OF ENERGY OR THE UNITED STATES GOVERNMENT. NO DATA WAS USED IN PRODUCING THIS MANUSCRIPT. FINITE-ELEMENT MESHES USED FOR THIS ANALYSIS WERE GENERATED BY CUBIT, AVAILABLE AT HTTP://CUBIT.SANDIA.GOV. FUNDING SUPPORT WAS PROVIDED BY THE SANDIA NATIONAL LABORATORIES LDRD PROGRAM.","0956-540X","GEOPHYS. J. INT.","GEOPHYSICAL JOURNAL INTERNATIONAL","ENGLISH","SEP","51","3",NA,"1901-1912","OXFORD UNIV PRESS","GEOCHEMISTRY \& GEOPHYSICS",6,"MODELLING DC RESPONSES OF 3-D COMPLEX FRACTURE NETWORKS","ARTICLE","WOS000439648000024","0","16","214","GEOCHEMISTRY \& GEOPHYSICS","SCIENCE CITATION INDEX EXPANDED (SCI-EXPANDED)",2018,"BESKARDES, GD (CORRESPONDING AUTHOR), SANDIA NATL LABS, DEPT GEOPHYS, ALBUQUERQUE, NM 87123 USA","ISI","SANDIA NATL LABS;SANDIA NATL LABS;UNIV NEW MEXICO","SANDIA NATL LABS","BESKARDES GD, 2018, GEOPHYS J INT","BESKARDES GD, 2018, GEOPHYS J INT","USA",2,0
"BIAN K, 2018, MRS ADV","BIAN K;ALARID L;ROSENBERG D;FAN H",NA,"CRYSTAL-STRUCTURE; HEXANITROHEXAAZAISOWURTZITANE; COCRYSTAL; GROWTH;; HNIW","FAN, HY (CORRESPONDING AUTHOR), SANDIA NATL LABS, ALBUQUERQUE, NM 87106 USA.; FAN, HY (CORRESPONDING AUTHOR), UNIV NEW MEXICO, DEPT CHEM \& BIOL ENGN, CTR MICROENGINEERED MAT, ALBUQUERQUE, NM 87131 USA.; BIAN, KAIFU; ALARID, LEANNE; ROSENBERG, DAVID; FAN, HONGYOU, SANDIA NATL LABS, ALBUQUERQUE, NM 87106 USA.; FAN, HONGYOU, UNIV NEW MEXICO, DEPT CHEM \& BIOL ENGN, CTR MICROENGINEERED MAT, ALBUQUERQUE, NM 87131 USA.","BAI F, 2011, NANO LETT, V11, P5196, DOI 10.1021/NL203598N; BAYAT Y, 2014, J MOL LIQ, V193, P83, DOI 10.1016/J.MOLLIQ.2013.12.028; BUMPUS JA, 2012, ADV PHYS CHEM, DOI 10.1155/2012/175146; GHOSH M, 2014, CRYST GROWTH DES, V14, P5053, DOI 10.1021/CG500644W; GOEDE P, 2004, PROPELL EXPLOS PYROT, V29, P205, DOI 10.1002/PREP.200400047; GUO CY, 2013, J MOL STRUCT, V1048, P267, DOI 10.1016/J.MOLSTRUC.2013.05.025; LIU K, 2016, J MOL STRUCT, V1110, P91, DOI 10.1016/J.MOLSTRUC.2016.01.027; NAIR UR, 2005, COMBUST EXPLO SHOCK+, V41, P121, DOI 10.1007/S10573-005-0014-2; NIELSEN AT, 1990, J ORG CHEM, V55, P1459, DOI 10.1021/JO00292A015; RUSSELL TP, 1993, J PHYS CHEM-US, V97, P1993, DOI 10.1021/J100111A043; SIMPSON RL, 1997, PROPELL EXPLOS PYROT, V22, P249, DOI 10.1002/PREP.19970220502; TALAWAR MB, 2007, COMBUST EXPLO SHOCK+, V43, P62, DOI 10.1007/S10573-007-0010-9; TAN JJ, 2011, PHYSICA B, V406, P2925, DOI 10.1016/J.PHYSB.2011.03.062; URBELIS JH, 2014, CRYST GROWTH DES, V14, P1642, DOI 10.1021/CG401774S; XU JJ, 2012, J CRYST GROWTH, V354, P13, DOI 10.1016/J.JCRYSGRO.2012.05.036; YANG ZW, 2014, RSC ADV, V4, P65121, DOI 10.1039/C4RA12248H; ZHONG Y, 2014, ACS NANO, V8, P827, DOI 10.1021/NN405492D","MORPHOLOGICAL CONTROL OF ENERGETIC MATERIALS (EM) IS HIGHLY DESIRED BECAUSE ILL-DEFINED MORPHOLOGY ARISING FROM VARIATIONS IN PROCESSING METHOD AND SUPPLIER MAKE IT IMPOSSIBLE TO REPRODUCIBLY ENGINEER THEIR PHYSICOCHEMICAL PROPERTIES. AS THE MOST POWERFUL, NON NUCLEAR ENERGETIC MATERIAL TO DATE, 2,4,6,8,10,12-HEXANITRO -2,4,6,8,10,12-HEXAAZAISOWURTZITANE (CL-20) HAS BEEN THE SUBJECT OF SIGNIFICANT INTEREST FOR IMPROVED APPLICATIONS IN MILITARY GRADE EXPLOSIVES. HERE WE REPORT A NEW METHOD FOR RECRYSTALLIZATION OF CL-20 FROM IRREGULAR BULK EMS USING A SURFACTANT ASSISTED SELF-ASSEMBLY PROCESS TO PRODUCE UNIFORM SPHERICAL MICRONSIZED PARTICLES. DETAILED ELECTRON MICROSCOPY STUDIES INDICATE THAT SURFACTANT PLAYS A CRITICAL ROLE IN CONTROLLING CL-20 MORPHOLOGY. COMBINED X-RAY DIFFRACTION AND RAMAN SPECTROSCOPY RESULTS REVEAL THAT THE RESULTANT SPHERICAL CL-20 PARTICLES EXHIBIT AN ORTHORHOMBIC BETA-PHASE CRYSTAL STRUCTURE. THIS MATERIAL IS EXPECTED TO DISPLAY ENHANCED FUNCTIONAL REPRODUCIBILITY DUE TO ITS MONODISPERSE NATURE AS WELL AS DECREASED SHOCK SENSITIVITY DUE TO THEIR SUB-MICRON PARTICLE SIZE.","32 AVENUE OF THE AMERICAS, NEW YORK, NY 10013-2473 USA","UNITED STATES DEPARTMENT OF ENERGY (DOE); SANDIA NATIONAL LABORATORIES; UNIVERSITY OF NEW MEXICO",NA,NA,"2022-12-01","GP5PR","10.1557/adv.2018.307",NA,NA,NA,NA,"SANDIA'S LABORATORY DIRECTED RESEARCH \& DEVELOPMENT (LDRD) PROGRAM; U.S. DEPARTMENT OF ENERGY'S NATIONAL NUCLEAR SECURITY ADMINISTRATION [DE-NA0003525]","THIS WORK WAS SUPPORTED BY SANDIA'S LABORATORY DIRECTED RESEARCH \& DEVELOPMENT (LDRD) PROGRAM. SANDIA NATIONAL LABORATORIES IS A MULTIMISSION LABORATORY MANAGED AND OPERATED BY NATIONAL TECHNOLOGY AND ENGINEERING SOLUTIONS OF SANDIA, LLC., A WHOLLY OWNED SUBSIDIARY OF HONEYWELL INTERNATIONAL, INC., FOR THE U.S. DEPARTMENT OF ENERGY'S NATIONAL NUCLEAR SECURITY ADMINISTRATION UNDER CONTRACT DE-NA0003525.","2059-8521","MRS ADV.","MRS ADVANCES","ENGLISH",NA,"17","41",NA,"2421-2427","CAMBRIDGE UNIV PRESS","MATERIALS SCIENCE",1,"SURFACTANT ASSISTED SELF-ASSEMBLY AND SYNTHESIS OF HIGHLY UNIFORM SPHERICAL CL-20 MICROPARTICLES","ARTICLE","WOS000440925900001","0","8","3","MATERIALS SCIENCE, MULTIDISCIPLINARY","EMERGING SOURCES CITATION INDEX (ESCI)",2018,"FAN, HY (CORRESPONDING AUTHOR), SANDIA NATL LABS, ALBUQUERQUE, NM 87106 USA","ISI","SANDIA NATL LABS;UNIV NEW MEXICO;SANDIA NATL LABS;UNIV NEW MEXICO","SANDIA NATL LABS","BIAN K, 2018, MRS ADV","BIAN K, 2018, MRS ADV","USA",4,0
"BLUM-SORENSEN CJ, 2022, PROPELLANTS EXPLOS PYROTECH","BLUM-SORENSEN CJ;DUARTE CA;DRAKE JD;KERSCHEN NE;FEZZAA K;KOSLOWSKI WW;SON SF","ENERGETIC MATERIALS; VOID COLLAPSE; BETA-HMX; ENGINEERED DEFECT; HOT; SPOT",NA,"SON, SF (CORRESPONDING AUTHOR), PURDUE UNIV, SCH MECH ENGN, W LAFAYETTE, IN 47907 USA.; BLUM-SORENSEN, CHRISTIAN J.; DUARTE, CAMILO A.; KERSCHEN, NICHOLAS E.; KOSLOWSKI, MARISOL; SON, STEVEN F., PURDUE UNIV, SCH MECH ENGN, W LAFAYETTE, IN 47907 USA.; DRAKE, JONATHAN D.; CHEN, WEINONG W.; SON, STEVEN F., PURDUE UNIV, SCH AERONAUT \& ASTRONAUT, W LAFAYETTE, IN 47907 USA.; FEZZAA, KAMEL, ARGONNE NATL LAB, APS SECT 32, LEMONT, IL 60439 USA.","ANONYMOUS, 1974, MIL DTL 45444C DETAI; ARMSTRONG M., 2018, TIME RESOLVED XRAY I; BAER MR, 2002, THERMOCHIM ACTA, V384, P351, DOI 10.1016/S0040-6031(01)00794-8; BOWDEN F.P., 1952, INITIATION GROWTH EX; CADY HH, 1963, ACTA CRYSTALLOGR, V16, P617, DOI 10.1107/S0365110X63001651; DUARTE CA, 2021, J APPL PHYS, V129, DOI 10.1063/5.0025050; DUARTE CA, 2020, PROPELL EXPLOS PYROT, V45, P243, DOI 10.1002/PREP.201900251; ESCAURIZA EM, 2020, SCI REP-UK, V10, DOI 10.1038/S41598-020-64669-Y; HANDLEY CA, 2018, APPL PHYS REV, V5, DOI 10.1063/1.5005997; KERSCHEN NE, 2020, PROPELL EXPLOS PYROT, V45, P607, DOI 10.1002/PREP.201900217; KERSCHEN NE, 2019, PROPELL EXPLOS PYROT, V44, P447, DOI 10.1002/PREP.201800002; MCGRANE SD, 2009, J APPL PHYS, V105, DOI 10.1063/1.3091270; MENIKOFF R, 2002, COMBUST THEOR MODEL, V6, P103, DOI 10.1088/1364-7830/6/1/306; PALMER SJP, 1982, P ROY SOC LOND A MAT, V383, P399, DOI 10.1098/RSPA.1982.0137; PAULSON SC, 2020, J DYNAM BEHAV MAT, V6, P34, DOI 10.1007/S40870-019-00225-8; SCHNEIDER CA, 2012, NAT METHODS, V9, P671, DOI 10.1038/NMETH.2089","IMAGING THE COLLAPSE OF A SINGLE VOID THAT CREATES A HOT SPOT INITIATION SITE IN AN OTHERWISE DEFECT-FREE EXPLOSIVE IS CHALLENGING GIVEN THE SPATIAL AND TEMPORAL SCALES INVOLVED IN EXPLOSIVE SYSTEMS. THIS WORK PRESENTS OUR ATTEMPT TO EXAMINE A SINGLE HOT SPOT MODE (VOID COLLAPSE) IN SINGLE-CRYSTAL OCTAHYDRO-L,3,5,7-TETRANITRO-L,3,5,7-TETRAZOCINE (HMX) EMBEDDED IN SYLGARD. THE HOT SPOT HEATING MECHANISMS INVOLVED WITH PORE COLLAPSE INCLUDE ADIABATIC HEATING, JETTING, AND VISCOPLASTIC DISSIPATION. QUANTIFYING THE DYNAMICS OF A PORE COLLAPSE IS A CRUCIAL STEP TO UNDERSTANDING WHICH MECHANISMS DOMINATE DURING IGNITION EVENTS. OUR EXPERIMENTS WERE CONDUCTED WITH A SINGLE-STAGE, LIGHT-GAS GUN AT ARGONNE NATIONAL LABORATORY'S ADVANCED PHOTON SOURCE, APPLYING THE PHASE CONTRAST IMAGING TECHNIQUE WHILE COLLECTING HIGH-SPEED VIDEO. THE DETAILS OF HMX SINGLE CRYSTAL PRODUCTION, DEFECT (PORE) ENGINEERING, AND SAMPLE CONSTRUCTION, ALONG WITH EXPERIMENTAL RESULTS ARE PRESENTED HERE. THESE RESULTS DEMONSTRATE THAT DETAILED COLLAPSE DYNAMICS CAN BE OBTAINED FROM HOMOGENEOUS, SINGLE-CRYSTAL EXPLOSIVES WITH THIS APPROACH. QUALITATIVE COMPARISONS ARE MADE WITH SIMULATION DATA WHICH SHOW GOOD AGREEMENT IN THE TRANSITION BETWEEN A QUASI-SYMMETRIC PORE COLLAPSE AND AN ASYMMETRIC COLLAPSE WITH JETTING ACROSS THE PORE AS MEASURED WITH NORMALIZED PORE AREA AND PORE CIRCULARITY.","POSTFACH 101161, 69451 WEINHEIM, GERMANY","PURDUE UNIVERSITY SYSTEM; PURDUE UNIVERSITY; PURDUE UNIVERSITY WEST LAFAYETTE CAMPUS; PURDUE UNIVERSITY SYSTEM; PURDUE UNIVERSITY; PURDUE UNIVERSITY WEST LAFAYETTE CAMPUS; UNITED STATES DEPARTMENT OF ENERGY (DOE); ARGONNE NATIONAL LABORATORY","E202100297","SSON@PURDUE.EDU","2022-12-01","5C1GP","10.1002/prep.202100297","AUG 2022","1521-4087",NA,NA,"US DEPARTMENT OF DEFENSE; OFFICE OF NAVAL RESEARCH; MURI [N00014-16-1-2557]; DURIP [FA9550-16-1-0315]; DOE OFFICE OF SCIENCE [DE-AC0206CH11357]","THIS WORK WAS SUPPORTED BY THE US DEPARTMENT OF DEFENSE, OFFICE OF NAVAL RESEARCH, MURI CONTRACT NUMBER N00014-16-1-2557, PROGRAM MANAGERS: CHAD STOLTZ AND KENNY LIPKOWITZ. DURIP AWARD NO. FA9550-16-1-0315 (DR. MARTIN SCHMIDT, PROGRAM OFFICER) FOR PURCHASING THE SHIMADZU HPV X2 CAMERA WE USED FOR THESE EXPERIMENTS. THIS RESEARCH HAS ADDITIONALLY USED RESOURCES OF THE ADVANCED PHOTON SOURCE, A U.S. DEPARTMENT OF ENERGY (DOE) OFFICE OF SCIENCE USER FACILITY, OPERATED FOR THE DOE OFFICE OF SCIENCE BY ARGONNE NATIONAL LABORATORY UNDER CONTRACT NO. DE-AC0206CH11357.","0721-3115","PROPELLANTS EXPLOS. PYROTECH.","PROPELLANTS EXPLOSIVES PYROTECHNICS","ENGLISH","OCT","16","10","DUARTE CORDON, CAMILO ALBERTO/0000-0002-3328-368X BLUM-SORENSEN, CHRISTIAN/0000-0003-3059-5722",NA,"WILEY-V C H VERLAG GMBH","CHEMISTRY; ENGINEERING",0,"PHASE CONTRAST X-RAY IMAGING OF THE COLLAPSE OF AN ENGINEERED VOID IN SINGLE-CRYSTAL HMX","ARTICLE","WOS000834846900001","2","2","47","CHEMISTRY, APPLIED; ENGINEERING, CHEMICAL","SCIENCE CITATION INDEX EXPANDED (SCI-EXPANDED)",2022,"SON, SF (CORRESPONDING AUTHOR), PURDUE UNIV, SCH MECH ENGN, W LAFAYETTE, IN 47907 USA","ISI","PURDUE UNIV;KERSCHEN;PURDUE UNIV;PURDUE UNIV;ARGONNE NATL LAB","PURDUE UNIV","BLUM-SORENSEN CJ, 2022, PROPELLANTS EXPLOS PYROTECH","BLUM-SORENSEN CJ, 2022, PROPELLANTS EXPLOS PYROTECH","USA",7,0
