"INYANG E, 2020, SCI REP","INYANG E;ABHYANKAR V;CHEN B;CHO M",NA,"MATRIX METALLOPROTEINASES; BARRIER; INJURY; PERMEABILITY; DAMAGE;; MICROBUBBLES; ANGIOGENESIS; MIGRATION; JUNCTIONS; CELLS","CHO, M (CORRESPONDING AUTHOR), UNIV TEXAS ARLINGTON, DEPT BIOENGN, ARLINGTON, TX 76019 USA.; INYANG, EDIDIONG; CHEN, BO; CHO, MICHAEL, UNIV TEXAS ARLINGTON, DEPT BIOENGN, ARLINGTON, TX 76019 USA.; ABHYANKAR, VINAY, ROCHESTER INST TECHNOL, DEPT BIOMED ENGN, ROCHESTER, NY 14623 USA.","ABBOTT NJ, 2010, NEUROBIOL DIS, V37, P13, DOI 10.1016/J.NBD.2009.07.030; ABDUL-MUNEER PM, 2013, FREE RADICAL BIO MED, V60, P282, DOI 10.1016/J.FREERADBIOMED.2013.02.029; ALAM M, 2011, NEUROSCI LETT, V495, P135, DOI 10.1016/J.NEULET.2011.03.056; ALMUTAIRI MMA, 2016, CELL MOL LIFE SCI, V73, P57, DOI 10.1007/S00018-015-2050-8; ARMSTRONG JK, 2001, BIORHEOLOGY, V38, P239; ARNAOUTOVA I, 2010, NAT PROTOC, V5, P628, DOI 10.1038/NPROT.2010.6; BASKARAN H, 2001, J SURG RES, V101, P56, DOI 10.1006/JSRE.2001.6262; BLENNOW K, 2016, NAT REV DIS PRIMERS, V2, DOI 10.1038/NRDP.2016.84; CERNAK I, 2010, J CEREBR BLOOD F MET, V30, P1262, DOI 10.1038/JCBFM.2010.37; CHEN B, 2019, ACS APPL MATER INTER, V11, P4889, DOI 10.1021/ACSAMI.8B21410; CHESLOW L, 2016, CURR OPIN PHARMACOL, V26, P39, DOI 10.1016/J.COPH.2015.09.010; CISBANI G, 2012, CELL DEATH DIS, V3, DOI 10.1038/CDDIS.2012.121; COLLINS JM, 2007, BBA-BIOMEMBRANES, V1768, P1238, DOI 10.1016/J.BBAMEM.2007.01.012; COLLIS J, 2010, ULTRASONICS, V50, P273, DOI 10.1016/J.ULTRAS.2009.10.002; DOGGETT TM, 2014, ALCOHOL CLIN EXP RES, V38, P2414, DOI 10.1111/ACER.12525; GU JH, 2013, PLOS ONE, V8, DOI 10.1371/JOURNAL.PONE.0061641; IWASKIW AS, 2018, SHOCK WAVES, V28, P63, DOI 10.1007/S00193-017-0759-Z; JANELIDZE S, 2017, NEUROBIOL AGING, V51, P104, DOI 10.1016/J.NEUROBIOLAGING.2016.11.017; KANAGARAJ J, 2018, ANN BIOMED ENG, V46, P354, DOI 10.1007/S10439-017-1953-Y; KEEP RF, 2018, J CEREBR BLOOD F MET, V38, P1255, DOI 10.1177/0271678X18774666; LI CHUN-HUA, 2010, ZHONGGUO YAOLIXUE TONGBAO, V26, P1418; LI GL, 2010, ANN BIOMED ENG, V38, P2499, DOI 10.1007/S10439-010-0023-5; LINDQUIST LK, 2017, J NEUROPSYCH CLIN N, V29, P254, DOI 10.1176/APPI.NEUROPSYCH.16050100; LIPPMANN ES, 2014, SCI REP-UK, V4, DOI 10.1038/SREP04160; MARK KS, 2002, AM J PHYSIOL-HEART C, V282, PH1485, DOI 10.1152/AJPHEART.00645.2001; MASKARINEC SA, 2002, BIOPHYS J, V82, P1453, DOI 10.1016/S0006-3495(02)75499-4; MCRAE M, 2018, TISSUE BARRIERS, V6, DOI 10.1080/21688370.2017.1405774; MEAIRS S, 2007, PROG BIOPHYS MOL BIO, V93, P354, DOI 10.1016/J.PBIOMOLBIO.2006.07.019; MENON V, 2010, BRAIN STRUCT FUNCT, V214, P655, DOI 10.1007/S00429-010-0262-0; MOLOUGHNEY JOSEPH G, 2012, RECENT PAT BIOTECHNOL, V6, P200; PARDRIDGE W. M., 2003, MOL INTERV, V3, P151; PEARSON-LEARY J, 2017, TRANSL PSYCHIAT, V7, DOI 10.1038/TP.2017.122; RIBECCO-LUTKIEWICZ M, 2018, SCI REP-UK, V8, DOI 10.1038/S41598-018-19522-8; ROSAS-HERNANDEZ H, 2018, MOL NEUROBIOL, V55, P258, DOI 10.1007/S12035-017-0738-5; SALZAR RS, 2017, J NEUROTRAUM, V34, P1589, DOI 10.1089/NEU.2016.4600; SENGILLO JD, 2013, BRAIN PATHOL, V23, P303, DOI 10.1111/BPA.12004; SHETTY A. K., 2014, FRONTIERS CELLULAR N, V8; SMITH ES, 2015, NEUROBIOL DIS, V73, P254, DOI 10.1016/J.NBD.2014.10.008; SUN S, 2015, J NEUROTRAUM, V32, P1441, DOI 10.1089/NEU.2014.3699; SWEENEY MD, 2018, NAT REV NEUROL, V14, P133, DOI 10.1038/NRNEUROL.2017.188; TAYLOR CA, 2017, MMWR SURVEILL SUMM, V66, P1, DOI 10.15585/MMWR.SS6609A1; TSONEVA I, 2010, J BIOMED BIOTECHNOL, DOI 10.1155/2010/314213; VAN LINT P, 2007, J LEUKOCYTE BIOL, V82, P1375, DOI 10.1189/JLB.0607338; WANG T, 2015, J MOL NEUROSCI, V55, P240, DOI 10.1007/S12031-014-0313-8; WANG WZ, 2017, BRAIN BEHAV IMMUN, V64, P344, DOI 10.1016/J.BBI.2017.04.019; WANG X, 2013, NATURE, V501, P578; WONG SW, 2017, ANN BIOMED ENG, V45, P1083, DOI 10.1007/S10439-016-1733-0; YANG Y, 2013, J CEREBR BLOOD F MET, V33, P1104, DOI 10.1038/JCBFM.2013.56; ZHENG YY, 2017, DNA CELL BIOL, V36, P853, DOI 10.1089/DNA.2017.3818","BRAIN INJURIES CAUSED BY AN EXPLOSIVE BLAST OR BLUNT FORCE IS TYPICALLY PRESUMED TO ASSOCIATE WITH MECHANICAL TRAUMA TO THE BRAIN TISSUE. RECENT FINDINGS FROM OUR LABORATORY SUGGEST THAT SHOCKWAVES PRODUCED BY A BLAST CAN GENERATE MICRON-SIZED BUBBLES IN THE TISSUE. THE COLLAPSE OF MICROBUBBLES (I.E., MICROCAVITATION) MAY INDUCE A MECHANICAL TRAUMA AND COMPROMISE THE INTEGRITY OF THE BLOOD-BRAIN ENDOTHELIUM (BBE). TO TEST OUR HYPOTHESIS, WE ENGINEERED A BBE MODEL TO DETERMINE THE EFFECT OF MICROBUBBLES ON THE STRUCTURAL AND FUNCTIONAL CHANGES IN THE BBE. USING MONOLAYERS OF MOUSE PRIMARY BRAIN MICROVASCULAR ENDOTHELIAL CELLS, THE PERMEABILITY COEFFICIENT WAS MEASURED FOLLOWING SIMULATED BLAST-INDUCED MICROCAVITATION. THIS EVENT DOWN-REGULATED THE EXPRESSION OF TIGHT JUNCTION MARKERS, DISORGANIZED THE CELL-CELL JUNCTION, AND INCREASED PERMEABILITY. SINCE POLOXAMERS HAVE BEEN SHOWN TO RESCUE DAMAGED CELLS, THE CELLS WERE TREATED WITH THE FDA-APPROVED POLOXAMER 188 (P188). THE RESULTS INDICATE P188 RECOVERED THE PERMEABILITY, RESTORED THE TIGHT JUNCTIONS, AND SUPPRESSED THE EXPRESSIONS OF MATRIX METALLOPROTEINASES. THE BIOMIMETIC INTERFACE WE DEVELOPED APPEARS TO PROVIDE A SYSTEMATIC APPROACH TO REPLICATE THE STRUCTURE AND FUNCTION OF BBE, DETERMINE ITS ALTERATION IN RESPONSE TO TRAUMATIC BRAIN INJURY, AND TEST POTENTIAL THERAPEUTIC TREATMENTS TO REPAIR THE DAMAGED BRAIN ENDOTHELIUM.","MACMILLAN BUILDING, 4 CRINAN ST, LONDON N1 9XW, ENGLAND","UNIVERSITY OF TEXAS SYSTEM; UNIVERSITY OF TEXAS ARLINGTON; ROCHESTER INSTITUTE OF TECHNOLOGY","3054","MICHAEL.CHO@UTA.EDU","2022-12-01","NF1RQ","10.1038/s41598-020-59888-2",NA,NA,NA,NA,NA,NA,"2045-2322","SCI REP","SCIENTIFIC REPORTS","ENGLISH","FEB 20","49","1","CHO, MYOUNG RAE/0000-0002-8191-8045",NA,"NATURE PUBLISHING GROUP","SCIENCE \& TECHNOLOGY - OTHER TOPICS",6,"MODULATION OF IN VITRO BRAIN ENDOTHELIUM BY MECHANICAL TRAUMA: STRUCTURAL AND FUNCTIONAL RESTORATION BY POLOXAMER 188","ARTICLE","WOS000563079900038","0","1","10","MULTIDISCIPLINARY SCIENCES","SCIENCE CITATION INDEX EXPANDED (SCI-EXPANDED)",2020,"CHO, M (CORRESPONDING AUTHOR), UNIV TEXAS ARLINGTON, DEPT BIOENGN, ARLINGTON, TX 76019 USA","ISI","UNIV TEXAS ARLINGTON;UNIV TEXAS ARLINGTON;ROCHESTER INST TECHNOL","UNIV TEXAS ARLINGTON","INYANG E, 2020, SCI REP","INYANG E, 2020, SCI REP","USA",4,0
"JACKSON MJ, 2018, PROC INST MECH ENG PART B-J ENG MANUF","JACKSON MJ;NELSON JK;WHITFIELD JS;HANDY RG;SCHMIDT PL","MACHINING; EXPLOSIVES; SURROGATE MATERIALS; MANUFACTURING",NA,"JACKSON, MJ (CORRESPONDING AUTHOR), BONDED ABRAS GRP, CAMBRIDGE, MA 02139 USA.; JACKSON, MARK J., KANSAS STATE UNIV, MANHATTAN, KS 66506 USA.; JACKSON, MARK J., BONDED ABRAS GRP, CAMBRIDGE, MA 02139 USA.; JACKSON, MARK J.; NELSON, JAMESON K.; WHITFIELD, MICHAEL D., PURDUE UNIV, CTR ADV MFG, W LAFAYETTE, IN 47907 USA.; MORRELL, JONATHAN S., Y-12 NATL SECUR COMPLEX, OAK RIDGE, TN USA.; HANDY, RODNEY G.; SCHMIDT, PETER L., UNIV N CAROLINA, WILLIAM LEE COLL ENGN, CHARLOTTE, NC USA.","ANONYMOUS, 1958, FAST REACTION SOLIDS, P71; ASTAKHOV V, 1999, METAL CUTTING MECH; ASTAKHOV VP, 2008, MACH SCI TECHNOL, V12, P325, DOI 10.1080/10910340802306017; ASTAKHOV VP, 2004, J MATER PROCESS TECH, V146, P193, DOI 10.1016/J.MATPROTEC.2003.10.015; ASTAKHOV VP, 2006, TRIBOL INTER ENG, V52, P1; BOWDEN F.P., 1951, AM J PHYS, V19, P428, DOI 10.1119/1.1933017, DOI 10.1119/1.1933017; BOWDEN FP, 1956, UNPUB; BOWDEN FP, 1958, FAST REACTION SOLIDS; CARSLAW H.S., 1959, CONDUCTION HEAT SOLI; DAVIM J.P., 2008, ECOLOGICAL MACHINING; DOYLE ED, 1979, P ROY SOC LOND A MAT, V366, P173, DOI 10.1098/RSPA.1979.0046; JACKSON MJ, 2005, P I MECH ENG B-J ENG, V219, P245, DOI 10.1243/095440505X30168; JACKSON MJ, 2003, A12003 COMP SURV SEC; MANG J, 2003, LALP03011, P4; POLETICA M.F., 1969, CONTACT LOADS CUTTIN; SHAW M C, 1996, METAL CUTTING PRINCI; SILIN SS, 1979, SIMILARITY METHODS M; UKRAINCZYK N, 2010, CHEM BIOCHEM ENG Q, V24, P129","THE PROCESSING OF POLYMER-BONDED EXPLOSIVES IS NOT WIDELY REPORTED IN THE LITERATURE, ESPECIALLY THE MACHINING OF EXPLOSIVE SURROGATES IN THE COMBINED PLANING AND GRINDING OPERATION KNOWN AS PLANO-GRINDING. THE PROCESS OF MACHINING LONG PIECES OF AN INERT SUBSTITUTE USING A WAX BINDER TO HOLD SUGAR PARTICLES TOGETHER AND THEN SUBJECTING THE SURROGATE MATERIAL TO A LINEAR CUTTING MOTION TO GENERATE CHIP FRAGMENTS IS DESCRIBED. THE AIM AND PURPOSE OF THIS WORK IS TO ANALYZE THE MACHINING OF EXPLOSIVE SURROGATES IN TERMS OF CHIP FORMATION MODELS (OSCILLATING AND STRESS RATIO MODELS) AND SIMILARITY MODELS (CHIP COMPRESSION RATIO, POLETICA, AND PECLET NUMBERS). THE ANALYSIS OF MACHINING IS COMPARED TO STANDARD ENGINEERING MATERIALS SO THAT THE EXPLOSIVES ENGINEER CAN BENCHMARK MACHINING PERFORMANCE OF EXPLOSIVE SURROGATES TO STANDARD MATERIALS. THE ARTICLE CONCLUDES WITH STATEMENTS ON HOW TO IMPROVE THE UNDERSTANDING OF MACHINING OF EXPLOSIVE SURROGATES WITH SPECIFICALLY ENGINEERED ABRASIVE CUTTING TOOLS.","1 OLIVERS YARD, 55 CITY ROAD, LONDON EC1Y 1SP, ENGLAND","KANSAS STATE UNIVERSITY; PURDUE UNIVERSITY SYSTEM; PURDUE UNIVERSITY; PURDUE UNIVERSITY WEST LAFAYETTE CAMPUS; UNIVERSITY OF NORTH CAROLINA; UNIVERSITY OF NORTH CAROLINA CHARLOTTE",NA,"BONDEDABRASIVE@GMAIL.COM","2022-12-01","GU0YP","10.1177/0954405416683972",NA,"2041-2975",NA,NA,NA,NA,"0954-4054","PROC. INST. MECH. ENG. PART B-J. ENG. MANUF.","PROCEEDINGS OF THE INSTITUTION OF MECHANICAL ENGINEERS PART B-JOURNAL OF ENGINEERING MANUFACTURE","ENGLISH","OCT","18","12",NA,"2071-2082","SAGE PUBLICATIONS LTD","ENGINEERING",1,"CHIP FORMATION AND SIMILARITY IN THE PLANO-GRINDING OF EXPLOSIVE SURROGATES","ARTICLE","WOS000444981000001","1","4","232","ENGINEERING, MANUFACTURING; ENGINEERING, MECHANICAL","SCIENCE CITATION INDEX EXPANDED (SCI-EXPANDED)",2018,"JACKSON, MJ (CORRESPONDING AUTHOR), BONDED ABRAS GRP, CAMBRIDGE, MA 02139 USA","ISI","MJ (CORRESPONDING AUTHOR);KANSAS STATE UNIV;PURDUE UNIV;UNIV N CAROLINA","MJ (CORRESPONDING AUTHOR)","JACKSON MJ, 2018, PROC INST MECH ENG PART B-J ENG MANUF","JACKSON MJ, 2018, PROC INST MECH ENG PART B-J ENG MANUF","USA",5,0
"JHON S, 2018, INT J MIN SCI TECHNOL","JHON S;LI LIFENG LL;JEREMY GM","BLAST; TIMING SEQUENCE; SCATTER; RELIABILITY; RISK ANALYSIS; MONTE CARLO; SIMULATION",NA,"JHON, S (CORRESPONDING AUTHOR), UNIV KENTUCKY, DEPT MIN ENGN, LEXINGTON, KY 40506 USA.; JHON, SILVA; LI LIFENG, UNIV KENTUCKY, DEPT MIN ENGN, LEXINGTON, KY 40506 USA.; JEREMY, GERNAND M., PENN STATE UNIV, UNIVERSITY PK, PA 16802 USA.","ANDERSON D.A., 1985, P LST S EXPLOSIVES B, P28; BAJPAYEE T.S., 2003, J MINES METALS FUELS, V51, P344; BIROLINI A., 2017, RELIABILITY ENG THEO, V8; BLAIR D.P., 1999, FRAGBLAST, V3, P303; FRYE C., 2014, MICROSOFT EXCEL 2013; HARR M.E., 1987, RELIABILITY BASED DE; HECKARD RF, 2007, MIND ON STAT; HINZEN KG, 1988, INT J ROCK MECH MIN, V25, P439, DOI 10.1016/0148-9062(88)90984-9; KAPLAN S., 1981, RISK ANAL, V1, P11, DOI DOI 10.1111/J.1539-6924.1981.TB01350.X, 10.1111/J.1539-6924.1981.TB01350.X; LI L, 2015, BLASTING FRAGMENTATI, V9, P1; LUSK B., 2012, BLASTING FRAGMENTATI, V6, P1; MILLER D, 2007, I QUARR AUSTR 50 NAT; MODARRES M, 2009, RELIABILITY ENG RISK; REHAK TR, 2001, PROCEEDINGS OF THE TWENTY-SEVENTH ANNUAL CONFERENCE ON EXPLOSIVES AND BLASTING TECHNIQUE, VOL I, P165; SHAPIRO SS, 1965, BIOMETRIKA, V52, P591, DOI 10.1093/BIOMET/52.3-4.591; SHERWIN ER, 2005, SEL TOP ASSURANCE RE, V7, P1; SILVA-CASTRO J.J., 2012, BLAST VIBRATION MODE; SMITH D.J., 2005, RELIABILITY MAINTAIN; VERMA AK, 2010, SPRINGER SER RELIAB, P1, DOI 10.1007/978-1-84996-232-2; YANG R., 2009, INT S ROCK FRAGM BLA, P597; ZIO E., 2013, MONTE CARLO SIMULATI","MINING BLASTS MAY BE DEFINED AS THE USE OF EXPLOSIVE CHARGES IN A CONTROLLED MANNER BY FOLLOWING A TIGHTLY CONTROLLED TIMING SEQUENCE ACCORDING TO AN ASSIGNED FIRING ORDER. CHANGES OF TIMING BETWEEN CHARGES MAY RESULT IN AN ALTERED FIRING ORDER AND FAILURE OF THE BLASTING SEQUENCE, WHICH CAN CAUSE HIGH VIBRATION LEVELS, POOR FRAGMENTATION, AND/OR AN UNDESIRABLE ROCK MASS MOVEMENT DIRECTION. DESPITE THE IMPORTANCE OF TIMING IN DETERMINING MINE BLAST RESULTS, THERE EXISTS A LACK OF METHODOLOGIES OR TOOLS WITH WHICH TO ASSESS PERFORMANCE OF A COMPLETE BLAST BASED ON DELAY TYPE AND TIMING SEQUENCE. THIS DOCUMENT APPLIES RELIABILITY ENGINEERING PRINCIPLES TO EVALUATE THE PERFORMANCE OF A MINE BLAST. THE ANALYSES ARE BASED ON TEST RESULTS OF THE ACCURACY AND PRECISION OF ELECTRONIC AND PYROTECHNIC DETONATORS FOR TYPICAL FIRING TIMES USED IN A SURFACE COAL MINE, BUT MAY BE APPLIED TO A VARIETY OF MINES AND TIMING SCENARIOS. (C) 2017 PUBLISHED BY ELSEVIER B.V. ON BEHALF OF CHINA UNIVERSITY OF MINING \& TECHNOLOGY.","RADARWEG 29, 1043 NX AMSTERDAM, NETHERLANDS","UNIVERSITY OF KENTUCKY; PENNSYLVANIA COMMONWEALTH SYSTEM OF HIGHER EDUCATION (PCSHE); PENNSYLVANIA STATE UNIVERSITY; PENNSYLVANIA STATE UNIVERSITY - UNIVERSITY PARK",NA,"JHON.SILVA@UKY.EDU","2022-12-01","GC2BJ","10.1016/j.ijmst.2017.07.004",NA,"2212-6066",NA,NA,NA,NA,"2095-2686","INT. J. MIN. SCI. TECHNOL.","INTERNATIONAL JOURNAL OF MINING SCIENCE AND TECHNOLOGY","ENGLISH","MAR","21","2","GERNAND, JEREMY/0000-0002-7952-1815","195-204","ELSEVIER","MINING \& MINERAL PROCESSING",6,"RELIABILITY ANALYSIS FOR MINE BLAST PERFORMANCE BASED ON DELAY TYPE AND FIRING TIME","ARTICLE","WOS000429586700005","3","12","28","MINING \& MINERAL PROCESSING","SCIENCE CITATION INDEX EXPANDED (SCI-EXPANDED)",2018,"JHON, S (CORRESPONDING AUTHOR), UNIV KENTUCKY, DEPT MIN ENGN, LEXINGTON, KY 40506 USA","ISI","UNIV KENTUCKY;UNIV KENTUCKY;PENN STATE UNIV","UNIV KENTUCKY","JHON S, 2018, INT J MIN SCI TECHNOL","JHON S, 2018, INT J MIN SCI TECHNOL","USA",3,0
"JI C, 2021, PROCESS SAF ENVIRON PROTECT","JI C;YUAN S;JIAO Z;HUFFMAN MM;WANG Q","AEROSOL FLAMMABILITY; LIQUID AEROSOLIZATION; MACHINE LEARNING; LIQUID; DYNAMIC VISCOSITY; GAUSSIAN PROCESS REGRESSION","VAPOR-PRESSURES; N-HEPTANE; IGNITION; QSPR; EXPLOSIONS; ENERGY","WANG, QS (CORRESPONDING AUTHOR), TEXAS A\&M UNIV, MARY KAY OCONNOR PROC SAFETY CTR, ARTIE MCFERRIN DEPT CHEM ENGN, COLLEGE STN, TX 77843 USA.; JI, CHENXI; YUAN, SHUAI; JIAO, ZEREN; HUFFMAN, MITCHELL; EL-HALWAGI, MAHMOUD M.; WANG, QINGSHENG, TEXAS A\&M UNIV, MARY KAY OCONNOR PROC SAFETY CTR, ARTIE MCFERRIN DEPT CHEM ENGN, COLLEGE STN, TX 77843 USA.; JI, CHENXI; EL-HALWAGI, MAHMOUD M., TEXAS A\&M UNIV, GAS \& FUELS RES CTR, ARTIE MCFERRIN DEPT CHEM ENGN, COLLEGE STN, TX 77843 USA.","BALLAL DR, 1979, COMBUST FLAME, V35, P155, DOI 10.1016/0010-2180(79)90019-1; BOWEN PJ, 1994, J LOSS PREVENT PROC, V7, P233, DOI 10.1016/0950-4230(94)80071-5; BRAMBILLA M., 2003, MORGANKAUFMANN SERIE; CATTELL RB, 1966, MULTIVAR BEHAV RES, V1, P245, DOI 10.1207/S15327906MBR0102\_10; CHAUDHARI P, 2021, J LOSS PREVENT PROC, V69, DOI 10.1016/J.JLP.2020.104343; CHEN HF, 2020, J LOSS PREVENT PROC, V67, DOI 10.1016/J.JLP.2020.104227; CHUM-IN T, 2017, FUEL PROCESS TECHNOL, V156, P385, DOI 10.1016/J.FUPROC.2016.09.025; DANIS AM, 1988, COMBUST FLAME, V74, P285, DOI 10.1016/0010-2180(88)90074-0; EICHHORN J, 1955, PETROLEUM REFINER, V34, P194; GAJEWICZ A, 2010, ATMOS ENVIRON, V44, P1428, DOI 10.1016/J.ATMOSENV.2010.01.041; GARDAS RL, 2008, FLUID PHASE EQUILIBR, V265, P57, DOI 10.1016/J.FLUID.2008.01.002; HOROWITZ C. A., 2016, INT LEG MAT, V55, P740, DOI DOI 10.1017/S0020782900004253; HSU C-W., 2003, PRACTICAL GUIDE SUPP, P1396; HUANG GB, 2012, IEEE T SYST MAN CY B, V42, P513, DOI 10.1109/TSMCB.2011.2168604; IMO, 2018, IN IMO STRAT RED GHG; INTERNATIONAL MARITIME ORGANIZATION, 2018, IMO ACT RED GHG EM I; IVANCIUC O, 2007, REV COMPUTATIONAL CH, V23, P291, DOI DOI 10.1002/9780470116449.CH6; JASUJA AK, 1979, J ENG POWER-T ASME, V101, P250, DOI 10.1115/1.3446480; JENSEN T, 1981, IND ENG CHEM FUND, V20, P239, DOI 10.1021/I100003A010; JI CX, 2021, J LOSS PREVENT PROC, V70, DOI 10.1016/J.JLP.2021.104422; JI CX, 2020, OCEAN ENG, V218, DOI 10.1016/J.OCEANENG.2020.108241; JIAO ZR, 2020, ACS CHEM HEALTH SAFE, V27, P316, DOI 10.1021/ACS.CHAS.0C00075; JIAO ZR, 2020, J LOSS PREVENT PROC, V67, DOI 10.1016/J.JLP.2020.104226; JIAO ZR, 2020, IND ENG CHEM RES, V59, P15109, DOI 10.1021/ACS.IECR.0C02822; JIAO ZR, 2020, PROCESS SAF PROG, V39, DOI 10.1002/PRS.12103; JIAO ZR, 2019, PROCESS SAF ENVIRON, V129, P280, DOI 10.1016/J.PSEP.2019.06.027; KOHLBRAND H.T., 1991, PLANT OPERATIONS PRO, V10, P52, DOI 10.1002/PRSB.720100110., DOI 10.1002/PRSB.720100110; KRISHNA K, 2003, J HAZARD MATER, V104, P215, DOI 10.1016/S0304-3894(03)00273-5; LEFEBVRE AH, 2010, GAS TURBINE COMBUSTION ALTERNATIVE FUELS AND EMISSIONS, THIRD EDITION, P1, DOI 10.1201/9781420086058-F; MCGARRY J, 1983, IND ENG CHEM PROC DD, V22, P313, DOI 10.1021/I200021A023; MORIWAKI H, 2018, J CHEMINFORMATICS, V10, DOI 10.1186/S13321-018-0258-Y; NIAN ZHANG, 2018, 2018 EIGHTH INTERNATIONAL CONFERENCE ON INFORMATION SCIENCE AND TECHNOLOGY (ICIST), P358, DOI 10.1109/ICIST.2018.8426077; NIKOLAIENKO TY, 2016, RSC ADV, V6, P74785, DOI 10.1039/C6RA17055B; PAN Y, 2008, CHEMOMETR INTELL LAB, V92, P169, DOI 10.1016/J.CHEMOLAB.2008.03.002; PEDREGOSA F., 2011, JMLR, V12, P2825; POLYMEROPOULOS CE, 1984, COMBUST SCI TECHNOL, V40, P217, DOI 10.1080/00102208408923807; RDKIT, 2020, OP SOURC CHEM; SALEHI F, 2015, FLOW TURBUL COMBUST, V95, P1, DOI 10.1007/S10494-015-9604-6; SANTON RC, 2009, INST CHEM E, P370; WANG BB, 2019, CHEM ENG COMMUN, V206, P247, DOI 10.1080/00986445.2018.1483350; WANG BB, 2017, IND ENG CHEM RES, V56, P47, DOI 10.1021/ACS.IECR.6B04347; WITTEN IH, 2011, MOR KAUF D, P1; YUAN S, 2021, PROCESS SAF ENVIRON, V146, P499, DOI 10.1016/J.PSEP.2020.11.032; YUAN S, 2020, J HAZARD MATER, V386, DOI 10.1016/J.JHAZMAT.2019.121640; YUAN S, 2019, FUEL, V245, P467, DOI 10.1016/J.FUEL.2019.02.078; ZENG MX, 2019, ACS APPL MATER INTER, V11, P40099, DOI 10.1021/ACSAMI.9B14792; ZENG XL, 2007, ATMOS ENVIRON, V41, P3590, DOI 10.1016/J.ATMOSENV.2006.12.039","FLAMMABLE AND EXPLOSIVE HAZARDS, WHICH HAVE BEEN WELL STUDIED, ARE MAJOR SAFETY CONCERNS IN INDUSTRIAL PROCESSES. HOWEVER, THE LIQUID AEROSOLIZATION PHENOMENON, WHICH INCREASES THE FIRE AND EXPLOSION HAZARD OF BULK LIQUIDS, HAS NOT BEEN WIDELY RECOGNIZED. THIS WORK AIMS AT IDENTIFYING THE CONTRIBUTORS INFLUENCING LIQUID AEROSOL FLAMMABILITY AND SOLVING THEIR DATA DEFICIENCIES BY DEVELOPING QUANTITATIVE STRUCTURE PROPERTY RELATIONSHIP (QSPR) MODELS. 1215 LIQUID CHEMICALS AND 14 PREDICTORS HAVE BEEN INPUT TO TRAIN THE DEVELOPED MACHINE LEARNING MODELS VIA K-FOLD CROSS VALIDATION WITH THE CONSIDERATION OF PRINCIPAL COMPONENT ANALYSIS. THREE ROUNDS OF MODEL PERFORMANCE COMPARISONS ARE CONDUCTED TO FIND THE OPTIMAL MODELS FOR LIQUID DYNAMIC VISCOSITY (LDV), SURFACE TENSION (ST), AND LIQUID VAPOR PRESSURE (LVP). THE MOST PERSUASIVE MODEL FOR LDV IS OBTAINED BY THE EXPONENTIAL GAUSSIAN PROCESS REGRESSION ( GPR) APPROACH WITH SEVEN PRINCIPAL COMPONENTS, WHILE THE MATERN 5/2 GPR ALGORITHM IS THE MOST ROBUST MODEL FOR PREDICTING ST AND LVP. DUE TO THEIR GOOD INTERPRETATION AND PREDICTION PERFORMANCE, THE OPTIMIZED MACHINE LEARNING MODELS CAN BE USED TO PREDICT FLAMMABILITY-LEADING PROPERTIES FOR AEROSOLS AND CAN THEREFORE HELP DESIGN INHERENTLY SAFER PROCESSES INVOLVING POTENTIAL LIQUID AEROSOLIZATION. (C) 2021 INSTITUTION OF CHEMICAL ENGINEERS. PUBLISHED BY ELSEVIER B.V. ALL RIGHTS RESERVED.","RADARWEG 29, 1043 NX AMSTERDAM, NETHERLANDS","TEXAS A\&M UNIVERSITY SYSTEM; TEXAS A\&M UNIVERSITY COLLEGE STATION; TEXAS A\&M UNIVERSITY SYSTEM; TEXAS A\&M UNIVERSITY COLLEGE STATION",NA,"QWANG@TAMU.EDU","2022-12-01","RI9HW","10.1016/j.psep.2021.03.012","MAR 2021","1744-3598",NA,NA,"MARY KAYO'CONNOR PROCESS SAFETY CENTER AT TEXAS A\&M UNIVERSITY, USA","THE AUTHORS ARE GRATEFUL FOR THE SUPPORT BY THE MARY KAYO'CONNOR PROCESS SAFETY CENTER AT TEXAS A\&M UNIVERSITY, USA. INADDITION, THE AUTHORS WOULD LIKE TO EXPRESS SPECIAL THANKS TO DR. FAISAL KHAN FOR HIS INSPIRING SUGGESTIONS FOR THE ARTICLE.","0957-5820","PROCESS SAF. ENVIRON. PROTECT.","PROCESS SAFETY AND ENVIRONMENTAL PROTECTION","ENGLISH","APR","47",NA,"JIAO, ZEREN/0000-0002-2707-0346 HUFFMAN, MITCHELL/0000-0001-8606-589X WANG, QINGSHENG/0000-0002-6411-984X JI, CHENXI/0000-0003-3501-4018 YUAN, SHUAI/0000-0002-6155-1872","1357-1366","ELSEVIER","ENGINEERING",3,"PREDICTING FLAMMABILITY-LEADING PROPERTIES FOR LIQUID AEROSOL SAFETY VIA MACHINE LEARNING","ARTICLE","WOS000637217000111","2","6","148","ENGINEERING, ENVIRONMENTAL; ENGINEERING, CHEMICAL","SCIENCE CITATION INDEX EXPANDED (SCI-EXPANDED)",2021,"WANG, QS (CORRESPONDING AUTHOR), TEXAS A\&M UNIV, MARY KAY OCONNOR PROC SAFETY CTR, ARTIE MCFERRIN DEPT CHEM ENGN, COLLEGE STN, TX 77843 USA","ISI","TEXAS AANDM UNIV;TEXAS AANDM UNIV;TEXAS AANDM UNIV","TEXAS AANDM UNIV","JI C, 2021, PROCESS SAF ENVIRON PROTECT","JI C, 2021, PROCESS SAF ENVIRON PROTECT","USA",5,0
